kore1280,a aː b b̥ ç d d̠ʒ d̥ d̥ʑ̥ e eː e̞ h i ia ie io iu iɛ iʌ iː j k kʰ kˀ k̚ k͉ k͉̚ l lʎ lʲ lː m mb n nd nʲ n̚ n̪ o oː o̞̜ p pʰ pˀ p̚ p͉ p͉̚ s sʰ sˀ s̪ s̪ˀ s͉ t ts tɕ tɕʰ tʰ tˀ t̚ t̠ʃ t̠ʃʰ t̠ʃˀ t̪ t̪ʰ t̪ˀ t͉ t͉ɕ͉ t͉̚ u ua ue ui uɛ uʌ uː w x y z æ æː ø ŋ ɐ ɑ̟ː ɕ ɕʰ ɘː əː ɛ ɛː ɛ̝ ɡ ɡ̥ ɤ ɤː ɤ̞ ɦ ɨi ɪ ɭ ɯ ɯi ɯː ɯ̥ ɯ̽ ɲ ɾ ʃ ʊ̜ ʌ ʎ ʔ
kett1243,a aː ä a̟ a̟ː b d dʲ d̪ d̪ʲ e h i iː j k k̟ lʲ lˠ l̥ʲ l̥ˠ l̪ʲ l̪ˠ m m̥ n nʲ n̥ n̥ʲ n̪ n̺ o p pʲ q qχ r s sʲ s̪ s̪ʲ s̺ t tʲ t̠ʃʲ t̪ t̪ʲ u uː æ æː ø ŋ ŋ̥ ɔ ɔː ə ɛ ɛː ɡ ɡ̟ ɢ ɣ ɨ ɨː ɪ ɮ̺ ɯ ɲ ɵ̞ ɵ̞ː ɾ ʀ ʁ ʃʲ ʊ ʌ ʔ ʝ β χ
lakk1252,a aː ä b d d̪ e̞ˤ ḛ h i iː j k kʰ kʷ kʷʰ kʷʼ kʷː kʼ kː k͈ k͈ʷ l l̪ m n n̪ p pʰ pʼ pː p͈ q qʰ qʷ qʷʰ qʷʼ qʷː qʼ qː q͈ q͈ʷ r r̪ s sː s̪ s̪ː s͈ tsʰ tsʷʰ tsʷʼ tsʷː tsʼ tsː tʰ tʼ tː t̠ʃ t̠ʃʰ t̠ʃʷ t̠ʃʷʰ t̠ʃʷʼ t̠ʃʷː t̠ʃʼ t̠ʃː t̠͈ʃ t̠͈ʃʷ t̪ t̪s̪ t̪s̪ʰ t̪s̪ʷʰ t̪s̪ʷʼ t̪s̪ʷː t̪s̪ʼ t̪s̪ː t̪ʰ t̪ʼ t̪ː t͈ t͈s t͈sʷ u uː w x xʷ xʷː xː x͈ x͈ʷ z z̪ æˤ æ̰ ø̞ˤ ħ ɑ̝ ɑ̝ː ɞ̰ ɡ ɢ ɢʷ ɣ ɣʷ ʁ ʃ ʃʷ ʃʷː ʃː ʃ͈ ʃ͈ʷ ʒ ʒʷ ʔ ʜ χ χʷ χʷː χː χ͈ χ͈ʷ
kaba1278,ä äː a̟ː b ç ç̟ d dz dʑ d̠ʒ d̠ʒʲ d̪ d̪z̪ d̻ d̻z̻ eː e̞ː f fʼ h i iː j kxʷ kʲʰ kʲʼ kʷ kʷʰ kʷʼ kʼ k̟x̟ʲ k̟ʲʰ k̟ʲʼ l m n n̪ n̻ oː o̞ o̞ː p pʰ pʼ q qʰ qʷ qʷʰ qʷʼ qʼ qχ qχʷ qχʷʼ qχʼ r r̥ s s̪ s̻ t ts tsʷʼ tsʼ tɕ tɕʼ tɬʲʼ tʰ tʷʼ tʼ t̠ʃ t̠ʃʲ t̠ʃʲʼ t̠ʃʼ t̪s̪ t̪s̪ʼ t̪ʰ t̪ʼ t̻s̻ t̻s̻ʼ t̻ʰ t̻ʼ u uː v w x xʲ xʷ x̟ʲ z zʷ z̪ z̻ ħ ɐ ɑ ɑː ɔ ɕ ɕʼ ə ɛ ɜ ɞ ɡʲ ɡʷ ɡ̟ʲ ɣ ɣʲ ɣ̟ʲ ɦ ɨ ɬ ɬʲ ɬʲʼ ɬʼ ɬ̪ʲ ɬ̪ʲʼ ɮ ɮʲ ɮ̪ʲ ɯ ɾ ʁ ʁʷ ʃ ʃʼ ʃ͇ ʉ ʑ ʒ ʒ͇ ʔ ʔʷ ʕ ʝ ʝ̟ χ χʷ
nucl1302,a̟ b b̰ c cʰ cʼ c̬ʰ d dz dz̰ d̠ʒ d̠ʒ̰ d̪ d̰ e e̞ e̠̞ f h i j k kʰ kʼ k̬ʰ l lˠ l̥ˠ l̩ l̪ˠ m m̥ m̩ n n̥ n̩ n̪ o̞ p pʰ pʼ p̬ʰ qʼ qʼχ q̰ qχʼ r r̥ r̩ r̪ s s͉ t ts tsʰ tsʼ tʰ tʼ t̠ʃ t̠ʃʰ t̠ʃʼ t̠̬ʃʰ t̪ t̪ʰ t̪ʼ t̬sʰ t̬ʰ u v v̥ v̩ w x z ŋ ɑ ɔ ə̆ ɛ ɟ ɟ̰ ɡ ɡ̰ ɣ ɪ ɪ̠ ɫ ɯ̆ ɲ̟ ɴ ɸ ɾ ɾ̩ ʁ ʁ̰ ʃ ʃ͉ ʊ ʊ̟ ʋ ʍ ʒ ʔ β χ χʼ χ͉
buru1296,R R̪ a aː ãː ã̈ː äː b d dʑ d̠ʒ d̪ e̞ e̞ː f h i iː ĩ ĩː j k kʰ l l̪ m n n̪ o oː õ õː o̞ o̞ː p pf pʰ q qʰ r s s̪ t ts tsʰ tɕ tɕʰ tʰ t̠ʃ t̠ʃʰ t̪ t̪s̪ t̪s̪ʰ t̪ʰ u uː ũ ũː w x y z z̪ æ ŋ ɔ ɕ ɖ ɖʐ ə ɛ ɛː ɛ̃ ɛ̃ː ɡ ɢ ɪ ɬ ɳ ʁ ʂ ʃ ʈ ʈʂ ʈʂʰ ʈʰ ʊ ʌ ʌ̃ ʐ ʐʲ ʐ͇ ʒ ˥˦ ˧ ˩˨ χ
kuru1302,a aː ã ãː b b̤ c cç cçʰ d d̠ʒ d̠ʒː d̠ʒ̤ d̤ d̪ d̪ː d̪̤ e ẽ e̞ e̞ː ẽ̞ ẽ̞ː e̯ h i iː ĩ ĩː j jː j̃ j̃ː k kʰ kː l lː l̪ m n n̪ o oː õː o̞ o̞ː õ̞ õ̞ː o̯ p pʰ pː r rː r̠ r̠̃ r̪ s s̪ s̪ː t tʰ t̠ʃ t̠ʃʰ t̠ʃː t̪ t̪ʰ t̪ː u uː ũ ũː u̞ w wː w̃ w̃ː x ŋ ɐ ɑ ɑ̃ː ɔ̃ ɔ̃ː ɖ ɖː ɖ̤ ə əː ə̃ ɟ ɟʝ ɟ̤ʝ ɡ ɡʱ ɡ̤ ɪ ɪ̃ ɪ̈ ɲ ɳ ɽ ʈ ʈʰ ʈː ʊ ʊ̃ ʌ ʌ̃ ʔ χ
telu1262,a aː a̟ː b bʰ bː b̤ c cç cçʰ cʰ ç d dz dzː dː d̠ʒ d̠ʒː d̤ d̪ d̪ʰ d̪̤ e eː f h i iː j k kʰ kː k͉ l lː l̪ m mː n nː n̪ o oː o̞ p pʰ pː rː r̪ s s̪ t ts tsː tɕ tː t̠ʃ t̠ʃː t̪ t̪ʰ u uː v w w̃ æ æː ð ŋ ɐ ɑ ɒː ɔː ɕ ɖ ɖʰ ɖː ɖ̤ ə ɛ ɛː ɜ ɟ ɟʝ ɟʰ ɟ̤ʝ ɡ ɡʰ ɡʱ ɡː ɡ̤ ɡ͉ ɦ ɪ ɪː ɭ ɭː ɲ ɳ ɽ ɾ ʂ ʃ ʈ ʈʰ ʈː ʊ ʊː β̞ β̞ː
kota1263,a aː b bʲ cç d dʲ d̠ʒ d̠ʒʲ d̪ d̪ð d̪ʲ e ee̞ ee̞ː eː e̞ e̞ː i iː j k kʰ kʲʰ l lʲ m mʲ n nʲ n̚ n̚ʲ n̪ o oo̞ oo̞ː oː o̞ o̞ː p pʰ pʲʰ r rʲ s sʲ t tʰ tʲʰ t̠ʃ t̠ʃʰ t̠ʃʲʰ t̪ t̪ʰ t̪ʲʰ u uː v vʲ w z zʲ ð ŋ ŋʲ ɔ ɖ ɖʲ ə ɟʝ ɡ ɡɣ ɡʲ ɣ ɪ ɭ ɭʲ ɲ ɳ ɳʲ ɽ ɽʲ ɾ ʂ ʈ ʈʰ ʈʲʰ ʊ ʌ
mund1320,a aː ã a̟ b b̤ c cç cçʰ d d̠ʒ d̠ʒ̤ d̤ d̪ d̪̤ e eː e̞ ẽ̞ h i iː j j̃ k kʰ l l̪ m n nˀ n̪ o oː o̞ õ̞ p pʰ p̚ˀ r s t tʰ t̚ˀ t̠ʃ t̠ʃʰ t̪ t̪ʰ u uː ũː u̞ w æ̞̃ ŋ ŋː ɑ̃ ɔ ɖ ɖ̤ ə ɛ ɟ ɟʝ ɟ̤ʝ ɡ ɡʱ ɡ̤ ɪ ɪ̃ ɭ ɲ ɳ ɽ ɽ̃ ɾ ʈ ʈʰ ʈ̚ˀ ʊ ʊ̃ ʌ ʔ ˀb ˀbʷ ˀd ˀd̠ʒ ˀɖ ˀɡ
khar1287,a ao ã b bʱ b̚ˀ b̤ c cç cçʰ cʰ d d̚ˀ d̠ʒ d̠ʒ̤ d̤ d̪ d̪ʱ d̪̤ e ei eː f h i iː ĩ j k kʰ l lˠ l̩ l̪ m m̩ n n̩ n̪ o oi ou oː õ o̞ õ̞ p pʰ r s s̪ t ts tsʰ tʰ t̠ʃ t̠ʃʰ t̪ t̪ʰ u ui uː ũ ũː w æ æ̞̃ ŋ ŋ̟ ŋ̩ ɑ ɑe ɑɔ ɔ ɔɛ ɔʊ ɔ̯ ɖ ɖʱ ɖ̚ˀ ɖ̤ ɗ ɗʱ ə əɛ ɛ ɛ̃ ɛ̯ ɟ ɟʝ ɟʱ ɟ̚ˀ ɡ ɡʱ ɡ̤ ɦ ɪ ɪ̃ ɭ ɲ ɲ̩ ɳ ɸ ɽ ɽʱ ɽ̃ ɽ̤ ɾ ɾ̪ ʈ ʈʰ ʊ ʊɨ ʊ̃ ʌ ʔ ˀb ˀɗ ˀɟ
khas1269,a aː b b̤ c̚ ç d d̠ʒ d̤ d̪ e eː h i ia ie̞ iː j k kʰ k̚ l m m̩ n n̩ n̪ o oː p pʰ p̚ r r̩ r̪ s s̪ t tʰ t̚ t̪ t̪ʰ u uo uː w ŋ ŋ̩ ɔ ɔː ə ɛ ɛː ɟʝ ɟ̤ʝ ɡ ɡʱ ɨ ɪ ɪ̥̯ ɪ̯ ɭ ɭ̩ ɲ ɸ ɾ ʃ ʊ ʊ̯ ʔ
seda1262,a a̰ b̰ d̪̰ d̰ e ḛ h i ḭ j j̃ j̥ j̰ j̰̃ k kʰ kʷ l l̥ l̪ l̪̥ l̪̰ l̰ m mb m̥ m̰ n nd n̠d̠ʒ n̥ n̪ n̪d̪ n̪̥ n̪̰ n̰ o o̰ p pʰ r r̥ r̪ r̪̥ r̪̰ r̰ s s̪ t tʰ t̠ʃ t̪ t̪ʰ u ṵ w w̃ w̰ w̰̃ æ ŋ ŋɡ ŋ̥ ŋ̰ ɔ ɔ̰ ə ɛ ɛ̰ ɪ ɲ ɲ̥ ɲ̰ ʃ ʍ ʔ ˀb ˀd ˀl ˀm ˀn ˀr ˀw ˀŋ ˀɲ
cent1989,a ao aə aɛ aː a̟ a̟ː a̟̙ː c cʰ c̚ e ea ei̙ eː e̘ː e̞ə f h i ie iː j k kʰ k̚ l lˠ l̪ˠ m n n̪ o oa ou ou̙ oə oː o̘ː p pʰ p̚ r r̠ s s̪ t tʰ t̚ t̠ʃ t̠ʃʰ t̪ t̪ʰ u uə uː w ŋ ɑ ɑː ɒ ɒː ɓ ɔ ɔː ɔ̘ː ɗ ɗ̪ ə əɨ əɨ̙ əː ə̘ː ɛ ɛː ɛ̘ː ɤ ɨ ɨə ɨː ɪ ɪ̈ ɯ ɯə ɯː ɲ ɹ ɽ ʊ ʋ ʔ ʝ
viet1252,a aː a̟ː b c c̚ e ei f h i iə iʌ j k kp kp̚ kx k̚ k̚ʷ k̟ l l̪ m n n̪ o o̞ o̞u p p̚ s t tɕ tʰ t̚ t̪ t̪ʰ t̻ t̻ʰ u uə uʌ v w x z ŋ ŋm ŋʷ ŋ̟ ɐ ɓ ɔ ɔʌ̯ ɔː ɗ ɘ ɘ̯ ɛ ɛʌ̯ ɛː ɜ ɜ̯ ɡ ɣ ɤ ɤɰ ɤː ɪ ɪi ɪ̈ ɯ ɯə ɯʌ ɯ̞ ɯ̞ɰ ɯ̽ ɲ ɵ̞̯ ʊ ʊu ʊ̯ ʌ ʌ̯ ʔ ˥˩˩˥ ˦ ˦˥ ˦˥̰ ˦˨ ˦˩˨ ˧ ˧˥ ˧˩ ˨ ˨˩ ˨˩˥ ˨˩̤ ˩ ˩˧ ˩̰
mand1415,a ai au a˞ a̟ a̟˞ b cç cçʰ ç d dz e ei e̞ e̞˞ f f̩ h i ia iau ie iou iu i̥ j k kʰ l l̪ m m̩ n o ou oɤ oɤ˞ p pʰ s s̞̩ s̪ t ts tsʰ tɕ tɕʰ tʰ t̠ʃ t̠ʃ̺ t̠ʃ̺ʰ t̪ t̪s̪ t̪s̪ʰ t̪ʰ u ua uai uei uo uɘ uə u˞ u̥ v̩ w w˞ x y ye y̥ z̞̩ z̩ æ ŋ ɐ ɐ˞ ɐ̃˞ ɑ ɑ̃˞ ɕ ɖʐ ə ə˞ ə̃˞ ɜ ɜ˞ ɟʝ ɡ ɤ ɤ˞ ɤ̟ ɥ ɪ ɰ ɱ ɹ ɹ̺ ɻ̥̩ ɻ̩ ʁ̞ ʂ ʃ̺ ʈʂ ʈʂʰ ʊ ʋ ʐ ʔ ʝ ʝʷ ˥ ˥˦ ˦ ˦˨ ˧ ˧˥ ˧˦ ˧˨ ˧˨˥ ˧˨˧ ˨ ˩ χ
wuch1236,a ă b b̤̥ c cʰ c̤ ç d dz d̤̥ f h i ĩ j k kɦ kʰ l l̪ m m̩ n n̪ o̞ õ̞ p pɦ pʰ s s̪ t ts tsɦ tsʰ tz̤̥ tɦ tʰ t̪ t̪s̪ t̪s̪ɦ t̪s̪ʰ t̪ɦ t̪ʰ u v w y z z̞̩ z̞̩ʷ z̪ æ æ̃ ŋ ŋ̩ ɑ ɔ̆ ə ə̟ ə̟̆ ɟ ɡ ɡ̤̥ ɤ̞ ɦ ɰ ɲ ɻ ʔ ˥ ˥˦ ˥˧˥ ˥̆ ˦ ˧ ˨˥̆ ˨˧ ˩ ˩˨ χ
hakk1236,a ai au ä äi äu̽ c cʰ c̟ c̠ʰ ç ç̻̠ e eu e̞ e̞u f fʲ fʷ h hʷ i ia iau iäu̽ ie iu iɔ iɔ̽ i̞ä i̞e̞ j k kʰ kʷ kʷʰ k̚ k̟ k̟ʰ k̟ʲ k̟ʲʰ k̟̚ l lʷ l̪ m mb mbʲ mbʷ m̩ n nd ndʲ n̩ n̪d̪ p pʰ pʲ pʲʰ pʷ pʷʰ p̚ s sʷ s̪ s̻ t ts tsʰ tsʲ tsʲʰ tsʷ tsʷʰ tʰ tʲ tʲʰ tʷ tʷʰ t̚ t̪ t̪s̪ t̪s̪ʰ t̪ʰ t̪̻s̪̻ t̪̻s̪̻ʰ u ui u̽i v vʷ w z̞̩ æ ŋ ŋɡ ŋɡʷ ŋɡ̟ ŋ̩ ɔ ɔi ɔ̽ ɔ̽i ə ɛ ɲ ɲɟ ɲ̠ ɹ̩ ʃ ʋ ʔ ʔʷ ˥ ˥˩ ˦ ˦˥̆ ˧ ˧˥ ˧˩ ˧˩̆ ˨ ˨˩ ˩ ˩˨
yuec1235,a ai au aːĭ aːŭ a̞ b̥ d̥ d̥z̥ e ei e̯ f h i iu iːŭ j k kʰ kʷ kʷʰ k̚ l l̥ l̪ l̪̥ m m̩ n n̪ o ou p pʰ p̚ r s s̟ s̪ t ts tsʰ tʰ t̚ t̟s̟ t̟s̟ʰ t̠ʃ t̠ʃʰ t̠ʃʲ t̠ʃʲʰ t̪ t̪s̪ t̪s̪ʰ t̪ʰ u ui uːĭ w y æ æə̯ ŋ ŋɡ ŋʷ ŋ̩ œ œ̞ ɐ ɐi ɐu ɒ ɔ ɔi ɔːĭ ɔ̽ ɛ ɛu ɡ̥ ɪ ɪə̯ ɪ̞ ɪ̯ ɵ ɵy ʃ ʃʲ ʊ ʊə̯ ʊ̟ ʔ ʔʷ ˥ ˥˦ ˦ ˦˥˩ ˧ ˧˥ ˧˩ ˧˩̰ ˧˩̰ʔ ˨ ˩ ˩˧ β
iumi1238,a aː a̟ b c cʰ d dz d̪ d̪z̪ e e̞ e̯ f h i j j̥ k kʰ k̟ k̟ʰ l l̥ l̪ l̪̥ m mb mˀ m̥ m̩ n nd ndz nˀ n̥ n̩ n̪ n̪̥ o o̯ p pʰ s s̪ t ts tsʰ tʰ t̪ t̪s̪ t̪s̪ʰ t̪ʰ u w æ ŋ ŋɡ ŋɡ̟ ŋˀ ŋ̟ ŋ̟̥ ŋ̥ ɐ ɔ ə ɛ ɜ ɟ ɡ ɡ̟ ɪ ɲ ɲɟ ɲ̥ ʊ ʌ ʍ ʔ ˀl ˀm ˀn ˀŋ ˀŋ̟ ˀɲ ˥ ˥˦ ˦ ˧˨ˤ ˧˩ ˨˧ ˩̰
nyis1236,b d dʲ d̪ i i̥ j k l̪ l̪ʲ m n nʲ n̪ p r s s̪ t tʲ t̪ u u̥ x ŋ ɑ ɔ ɛ ɡ ɦ ɯ ʌ ʔ ˥˦ ˩˨
nucl1310,a aɪ aɪ̃ aʊ aʊ̃ ã b ç d d̠ʒ d̪ d̪ð d̪ð̪ e ei eĩ eɪ eɪ̃ ẽ̞ĩ h i ĩ j j̃ k kʰ l l̥ l̪ l̪̥ m m̥ m̥m n n̥ n̥n n̪ n̪̥ o ou oũ oʊ oʊ̃ õ̞ũ p pʰ s sʰ s̪ s̪ʰ t tʰ t̠ʃ t̠ʃʰ t̪ t̪ʰ t̪θ t̪θ̪ u ũ w w̃ z z̪ z͇ æ æ̃ ð ŋ ŋ̥ ŋ̥ŋ ɑ ɔ ə ɛ ɡ ɪ ɪ̃ ɬ ɬl ɲ ɲ̥ ɲ̥ɲ̥ ɹ ɾ ʃ ʊ ʊ̃ ʊ̈ ʍ ʍw ʔ ˥ ˥̰ ˦ ˦ˀ ˦̰ ˨ ˩ θ
lahu1253,a ai̯ au̯ ã b bv d dz d̠ʒ d̪ e e̞ e̯ f h i ii̯ j k kʰ l l̪ m mv m̩v n nʲ n̪ o o̯ p pf pfʰ pʰ q qʰ qχ s t ts tsʰ tʰ t̠ʃ t̠ʃʰ t̪ t̪ʰ u ue u̯a u̯e u̯i u̯ɛ v vʷ w x z z̞̩ ŋ ɔ ɔu̯ ɔ̃ ɔ̯ ɘ ə əi̯ əu̯ ɛ ɡ ɣ ɨ ɨi̯ ɨɛ ɪ ɪ̈ ɯ ɯ̃ ʃ ʊ ʔ ʝ ˥˦ ˧ ˧˦ ˧˨ ˩ ˩˨˧
garo1247,a b d dz d̪ e e̞ h i ĭ ĭ̥ k kʰ k̚ l m mˀ n nˀ n̪ o p pʰ p̚ s s̻ ts tʰ t̚ t̪ u w z ŋ ŋˀ ɘ ɡ ɤ̞ ɾ ɾˀ ʁ ʉ ʔ
sgaw1245,a c cʰ e e̞ e̠ h i j k kʰ l m n n̪ o p pʰ r s sʰ s̪ s̪ʰ t tʰ t̪ t̪ʰ u w x xʷ xˠ z z̪ z͇ æ ŋ ɓ ɔ ɗ ɗ̪ ə ə̆ ɛ ɜ ɣ ɦ ɨ̞ ɪ ɪ̈ ɲ ɹ ʃ ʊ ʒ ʔ ˦˥ ˦˩̰ ˧˨̤ ˧˩ ˧̆ ˩̤̆ θ
lakk1238,a aː ã ãː ă ẵ b̰ e ĕ f h i ie iẽ ie̞ iː ĩ ĩẽ̞ ĩː ĭ j j̥ k kʰ kʲ kʲʰ kʷ kʷʰ l l̥ l̪ l̪̥ m m̥ n n̥ n̪ n̪̥ õ ŏ̃ p pʰ t ts tsʰ tʰ t̪ t̪s̪ t̪s̪ʰ t̪ʰ u uo uː ũ ũː ŭ ŭ̃ w ŋ ŋʲ ŋʷ ŋ̥ʲ ɔ ɔː ɔ̃ ɔ̃ː ɛ ɛː ɛ̃ ɛ̃ː ɛ̆ ɛ̆̃ ɥ ɬ ʍ ʔ ˀb ˥ ˥˦ ˧˨˥ ˨˧ ˨˧˩ ˩ β̞ θ
thai1261,a aː b cç cçʰ d d̪ e ei eː e̞ː f fˠ h i ia iː j j̥ k kx kʰ k̚ l l̃ l̥ l̪ m mb m̥ n nd n̥ n̪ o oː o̞ p pʰ p̚ r s s̪ t tɕ tɕʰ tʰ tˠ t̚ t̪ t̪s̪ t̪s̪ʰ t̪ʰ u ua uː v w z æ æː ŋ ŋ̥ ɓ ɔ ɔː ɗ ɘ ɘː ɛ ɛː ɜ ɟʝ ɤ ɤː ɨ ɨː ɪ ɯ ɯa ɯː ɻ ɾ ɾ̃ ɾ̥ ʃ ʊ ʌ ʍ ʔ ʔ̚ ˥ ˥˩ ˥̰ ˦ ˧ ˧˥ ˧˩ ˨ ˨˧ ˩ ˩˧ β ∅
bouy1240,R R̪ a aː b c cʰ d d̪ f h i ia j k kʰ l l̪ m n n̪ p pʰ r s s̪ t tʰ t̪ t̪ʰ u ua v w ŋ ɔ ə ə̯ ɛ ɡ ɣ ɯ ɯa ɰ ɲ ʔ ˥ ˥˩ ˦ ˧ ˩ ˩˥ θ
west2650,a aː b b̰ c cç cʰ d d̰ e e̞ f h hʲ i iə j k kʰ k̚ k͉ l m mb n nd o ou p pʰ p̚ p͉ r t tʰ t̚ t͉ u uə w x æ ŋ ŋm ŋɡ ɐ ɔ ə ə̃ ə̯ ɛ ɤu ɨ ɭ ɲ ɳ ɺ ɽ ɾ ʂ ʃ ʈ ʈʰ ʊ ʐ ʔ ʔʲ ʔ̚ʷ ˀd ˀp ˦ ˧ ˩
atay1247,a aː ä b i iː j k l l̪ m n n̪ p q r s s̪ t ts t̠ʃ t̪ t̪s̪ u uː w x y ħ ŋ ɔ ɔː ə̆ ɛ ɛː ɡ ɣ ɾ ɾ̪ ʃ ʒ ʔ β
plat1254,a ḁ b d dz d̪ d̪z̪ e̞ e̞̥ f h hʲ i i̥ j k kʲ l l̪ m mb mp n nd ndz nt nts n̪ o p r r̪ s s̪ t ts t̪ t̪s̪ v w z z̪ ŋk ŋkʲ ŋɡ ŋɡʲ ɔ ɖr̠ ɖr̠͓ ɡ ɡʲ ɦ ɳɖr̠ ɳʈr̠̥ ɾ ʈr̠̥ ʈɹ̠̥ ʈʂ͇ ʊ ʊ̥
stan1306,a ã b b̚ c d d̚ d̠ʒ e ẽ f h i j k l l̥ m n o õ p p̚ q r s t t̚ t̠ʃ u v w x z ø̞ ŋ ɐ ɒ ɔ ə ɛ ɟ ɡ ɪ ɲ ɾ ʁ ʃ ʊ ʌ ʌː ʔ χ ∅
bata1289,a aː b d d̠ʒ d̪ e eː h i iː j k kʰ k̚ l l̥ l̪ m n n̪ o oː o̞ p pʰ p̚ r r̥ s s̪ t tʰ t̚ t̠ʃ t̪ u uː w æ æː ŋ ɔ ɔː ə ɛ ɛː ɡ ɲ ɾ ɾ̥ ʀ ʊ ʌ ʔ ʔ̚ ʔⁿ
saba1265,a aː b b͈ d d̠ʒ d̠͈ʒ d͈ e h i iː j k k̚ k͈ l l̥ l̩ m m̥ m̩ n n̥ n̩ p p̚ p͈ r r̩ s sː t t̚ t̠ʃ t͈ u uː w æ ŋ ŋ̥ ŋ̩ ɑ ɔ ɔə ɔː ə ɛ ɛə ɛː ɡ ɨ ɪ ɲ ɲ̥ ɲ̩ ɸ ɾ ʂ͇ ʊ ʌ ʔ β
sund1252,a ã b d d̠ʒ e h i ĩ j k kˀ l m n o õ p p̚ s t̠ʃ t̪ t̪̚ u ũ w x ŋ ɔ ə ə̃ ɛ ɛ̃ ɡ ɤ ɦ̃ ɨ ɨ̃ ɪ ɲ ɾ ʔ
java1254,a b b̤̥ d d̠ʒ d̤̥ d̪̤̥ e f h i j k kɦ l l̤ l̪ m n n̪ o p pɦ r s s̪ t ts tsɦ tz̤̥ tɦ t̠ʃ t̪ t̪ɦ u v w x y z ŋ ɔ ɖ ə ɛ ɡ ɡ̤̥ ɪ ɲ ɳ ʃ ʈ ʊ ʔ
taga1270,a aː ä b b̚ bⁿ c d d̚ d̠ʒ d̪ dⁿ e eː ẽ e̞ f h i iː j k kx k̚ kⁿ l l̪ m n n̪ o oː õ o̞ p p̚ pⁿ r s sʲ t ts t̚ t̠ʃ t̪ tⁿ u uː v w x ŋ ɔ ə ə̃ ɛ ɟ ɡ ɡ̚ ɡⁿ ɪ ɪ̃ ɲ ɾ ʃ ʊ ʊ̃ ʔ β
cham1312,b bː d dz dː e e̞ f h i j k kː l lː m mː n nː o o̞ p pʰ pː s sː s̪ t ts tː u w æ ŋ ɑ ɒ ɔ ə ɛ ɡ ɡː ɪ ɲ ɻ ɾ ʃ ʊ ʔ
iaai1238,a aː b bʷ d d̠ʒ d̪ e eː f h i iː j k l l̥ m mʷ m̥ m̥ʷ n n̥ n̪ o oː p s s̪ t t̠ʃ t̪ u uː w x y æ æː ð ø ŋ ŋm ŋ̥ ŋ̥m̥ œ ɔ ɔː ɔ̃ ɖ ɛ ɛː ɡ ɡb ɭ ɭ̥ ɯ ɲ ɲ̥ ɳ ɳ̥ ɸ ɹ ʃ ʈ ʍ β θ
kali1299,a aː e̞ e̞ː h i iː k kʰ l m mb n nd o̞ o̞ː p pʰ r s t tʰ u uː ŋ ŋɡ ɔ ɛ ɡ ɡɣ ɪ ɾ ʃ ʊ ʍ ʔ β
adze1240,a aː b d dz d̪ d̪z̪ f h i iː j kʰ m n n̪ o oː o̞ o̞ː pʰ r r̪ s s̪ tsʰ tʰ t̪s̪ʰ t̪ʰ ŋ ɡ ɯ ɰ ʔ
maor1246,e f h i iː j k k̟ʰ m n oː o̞ p pʰ t tʰ tʲ u uː w ŋ ŋʲ ŋ̟ ɑ ɑː ɒ ɛ ɛː ɛ̠ ɦ ɸ ɾ ʌ
hawa1245,a aː ḁ eː h i iː i̥ k l l̪ m n n̪ o oː o̞ o̥ p s t t̠ʃ u uː u̥ v w æ ə ə̥ ɛ ɛ̥ ʔ
anta1253,a aː a̟ b d d̪ d̻ e̞ i iː i˞ j k l l̠ l̪ l̻ m n n̠ n̪ n̻ o p r t t̠ t̪ t̻ u uː w ŋ ȴ ȵ ȶ ɐ ɐ˞ ɒ ɖ ɡ ɪ ɭ ɳ ɻ ɾ ʈ ʊ ʊ˞ ʊ̥
nyan1301,a ai aː a˞ ḁ b d d̻ e eː h i iː i˞ j j̥ k l l̥ l̻ l̻̥ m m̥ n n̥ n̻ n̻̥ p pɸ p̚ r r̥ s̻ t t̻ t̻̚ u ui uː u˞ w x xʷ y z̻ æ ŋ ŋʷ ŋ̥ ȴ ȵ ȶ ɒ ɔ ɔ̥ ɖ ə ɜ ɡ ɣ ɪ ɪ̥ ɭ ɭ̥ ɳ ɳ̥ ɸ ɻ ɻ̥ ɾ ɾ̥ ʈ ʈ̚ ʊ ʊ̥ ʍ ʔ β
kunj1245,a a˞ ã b c cʰ d d̻ f i j k kʰ l m n n̻ o̞ o̞˞ õ̞ p pʰ r r̥ t tʰ t̻ t̻ʰ v w æ ð ŋ ɔ ɖ ɛ ɛ˞ ɛ̃ ɜ ɟ ɡ ɣ ɪ ɪ˞ ɪ̃ ɲ ɸ ɻ ɻ̥ ʈʰ ʊ ʊ˞ ʊ̃ β
mara1386,a b d d̠ʒ e i j k kː l m mː n nː o p pː r t tː t̠ʃ t̠ʃː u w æ ð ŋ ɑ ɔː ə ɛ ɡ ɪ̈ ɲ ɹ ʊ θ
maun1240,a aː a˞ a̟ b d d̻ e i i˞ j k l m n n̠ n̻ o p r t t̠ t̪ t̻ u u˞ w ŋ ŋ̟ ȵ ȶ ɔ ɔ˞ ɖ ə ɛ ɛ˞ ɡ ɣ ɪ ɭ ɳ ɹ ɻ ɽ ʈ ʊ ʔ
nung1290,a aː aːi b c̟ c̟ʰ d e˞ i iː j k kʰ l l̪ m n n̠ n̪ p pʰ r t tʰ t̠ t̪ u uː w æ ŋ ȵ ȶ ɐ ɐi ɟ̟ ɡ ɤ ɪ ɪ̈ ɭ ɯ̞ ɲ̟ ɳ ɻ ɾ ʈ ʊ
alaw1244,a b c c̟ d e e̞ e̞ː i j k k͈ k͉ l l̠ m mb n nd n̠ n̠d̠ p p͈ p͉ r t t̠ t͈ t͉ u w æ ŋ ŋɡ ȴ ȵ ȶ͈ ȶ͉ ɑ ɖ ɟ ɟ̟ ɡ ɤ̞ ɪ ɭ ɯ̞ ɲ ɲɟ ɲ̟ ɲ̟ʝ̟ ɳ ɳɖ ɹ ɻ ɾ ɾl ɾn ɾ̥ ɾ͓ ʈ ʈ͈ ʈ͉ ʎ̟ ʔ
wikm1247,a aː b c̟ d e eː i iː j k l l̺ m n n̠ n̪ n̺ o oː p r r̥ r̺ t t̠ t̪ t̺ u uː w ŋ ȵ ȶ ɒ ɒː ɔ ɔː ɛ ɛː ɟ̟ ɡ ɲ̟ ɹ̺ ɾ ʊ ʊː ʔ
nucl1632,a̟ b c d d̠ʒ d̪ e f h i ii̯ j k m n n̪ o p q s t tʲ t̪ u w x ø̞ ŋ ɔ ə ɛ ɲ ɸ ɺ
kwom1262,a ḁ b d d̠ʒ e h i i̥ j k kʷ l m mb mbʷ mʷ n nd n̠d̠ʒ o̞ o̞̥ p pʷ s t t̠ʃ u u̥ w y æ ŋɡ ŋɡʷ ɔ ɛ ɜ ɡ ɨ ɨ̥ ɪ ɪ̥ ɲ ɸ ɸʷ ɾ ʃ ʉ ʔ β
tamn1235,a a̟ b d d̠ʒ e f i j k k̚ kⁿ m mb n nd o p pʷ p̚ pⁿ r s s͉ t tʲ t̚ t̠ʃ tⁿ u w x y æ ø ɔ ə ɛ ɤ ɪ ɸ ɾ ʃ ʉ ʝ θ
tele1256,a aː b bm d dn f h i iː j k kʷ k̚ l m n p pɸ s t u uː w ŋ ɐ ɓ ɔ ɔː ɗ ə ɛ ɛː ɜ ɡ ɡŋ ɣ ɪ ɬ ɭ ɸ ɺ ɾ ʉ ʉː ʊ ʔ ˥ ˥˦ ˦ ˧ ˧˨ ˧˩ ˨ ˨˧ β
gads1258,a a̟ː b d d̠ʒ eː i i̥ j k kʰ m n n̪ oː p pʰ s t ts t̻ t̻ʰ u x ŋ ɛː ɜ ɪ ɸ ɾ ʊ ʔ ʝ ˥ ˥˦ ˧ ˧˥ ˧˩ ˩ ˩˨ β β̞
awiy1238,aː e i j k m mː n nː o̞ p s t u w ə ɛ ɣ ɪ ɺ ɾ ʔ ˥ ˥˩ ˩ β
kuni1267,a b bβ dl d̪ d̪ð e i j k kx kʰ l lː l̥ l̪ m n n̪ o p pɸ pʰ q qʰ qχ r̠ s sʲ s̪ t ts tʰ t̪ t̪θ u w x z zʲ z̪ ð ŋ ɑ ɘ ə ɡ ɡɣ ɢ ɢʁ ɣ ɪ ɸ ɽ ɽ̥ ʁ ʈɽ ʊ β β̞ χ
sele1250,a a̠ b d e f h i j k kʰ k̚ l m mb n nd n̪ n̪d̪ o o̟ p pʰ p̚ r s sʲ t tʰ t̚ t̪ʰ u u̟ w zʲ ŋ ŋɡ ŋ̟ ɑ ɑ̝ ɛ ɡ ɣ ɪ ɲ̟ ɶ̝ ɸ ɾ β
naas1242,a aː b d i iː k m n n̪ o oː p r s t ts t̪ u uː ŋ ɛ ɛː ɲ ɺ ɾ ɾ̪ ʔ β
aleu1260,a aː f h i iː j j̥ k l lʲ l̥ l̥ʲ l̪ m m̥ n nʲ n̥ n̥ʲ n̪ n̪̥ p q qχ r t ts tʲ t̠ʃ t̪ t̪s̪ u uː v w x ð ðʲ ŋ ŋ̥ ɣ ɬ ɬ̪ ʁ ʃ ʍ ʒ ʔ β χ
kala1399,a aː e fː h i i̥ j k kː l l̪ m mː n nː n̪ o p pː q qː s s̪ s̻ s̻ː t ts tː tːs t̪ t̪s̪ u u̥ v w xː ŋ ŋː ɑ̴ ɑ̴ː ɔ̴ ɔ̴ː ə̴ ə̴ː ɣ ɪː ɬː ɬ̪ː ɴ ɴː ɸː ʁ ʃ ʃː ʊː ʔ ʝ β χ χː
chip1261,a aː ã ãː e h i iː ĩ ĩː j k kx kxʰ kxʷ kxʷʰ kʷ kʷʼ kʼ l l̥ l̪ l̪̥ m n n̪ o p r r̪ s s̪ t ts tsʰ tsʼ tx tɬ tɬʰ tɬʼ tʼ tˠʰ t̠ʃ t̠ʃʰ t̠ʃʼ t̪ t̪s̪ t̪s̪ʰ t̪s̪ʼ t̪ɬ̪ t̪ɬ̪ʰ t̪ɬ̪ʼ t̪ʼ t̪ˠʰ t̪θ t̪θʰ t̪θʼ u uː ũ ũː w x xʷ z z̪ ð ə ɛ ɛː ɛ̃ ɛ̃ː ɣ ɣʷ ʃ ʍ ʔ ʝ ˥ ˥˦ ˩ ˩˨ θ
tolo1259,a aː ã ãː e̞ e̞ː h i iː ĩ ĩː j j̃ k kʷ kʷʼ kʼ l m mˀ n nˀ n̩ o p pʰ s t tsʼ tɬ tʰ tʼ t̠ʃ t̠ʃʰ t̠ʃʼ u uː ũ ũː w x xʷ æ æː ɐ ɑ ɑː ɔ ə ə̃ ɡ ɣ ɨ ɬ ʂ ʃ ʈ ʈʂʼ ʈʼ ʊ ʔ
hupa1239,a aː aˑ c cʰ cʼ e̞ e̞ː e̞ˑ h hʷ i iː j j̥ j͉ k kʰ kʼ l l̩ˠ m m̥ m͈ n n̥͈ n͈ o̞ o̞ː o̞ˑ p q qʰ qʼ s s̻ t ts tsʰ tsʼ tɬ tɬʼ tɬ̩ʼ tʰ tʼ t̠ʃ t̠ʃʰ t̠ʃʷʰ t̠ʃʷʼ t̠ʃʼ t̠ʃ̩ʷʼ t̠ʃ̩ʼ t̻s̻ t̻s̻ʰ t̻s̻ʼ t̻s̻̩ʼ tχ u w x xʷ ŋ ɤ ɪ ɪ̃̈ ɪ̈ ɬ ɯ ɲ ʃ ʊ ʌ ʏ ʔ
nava1243,a aː ã ãː cç cʝ ç dɮ d̪ɮ̪ e ẽ h hʷ iː ĩː j k kx kxʷ kɣ kɣʷ kʰ kʷʰ kʼ k̚ l l̪ m n n̩ n̪ oː õː p s s̩ s̪ t ts tsç tsx tsxʷ tsʰ tsʼ tx txʷ tɬ tɬʰ tɬʼ tʰ tʼ t̚ t̠ʃ t̠ʃʰ t̠ʃʼ t̪ t̪s̪ t̪s̪ʰ t̪s̪ʼ t̪ɬ̪ t̪ɬ̪ʼ t̪ʰ t̪ʼ uː ũː w x xʷ z z̪ ɔ ɔ̃ ɛ ɛː ɛ̃ ɛ̃ː ɣ ɣʷ ɪ ɪ̃ ɬ ɬ̩ ɬ̪ ʃ ʃ̩ ʊ ʊ̃ ʒ ʒ̩ ʔ ʝ ˀj ˀm ˀn ˥ ˩
nort2938,a c cʰ cʼ ç dl dɮ d̪ɮ̪ e h i j j̰ k kʰ kʷ kʷʰ kʷʼ kʼ l l̩ l̪ l̪̰ l̰ m m̰ n n̪ n̪̰ n̰ o p pʰ p̚ q qʰ qʷ qʷʰ qʷʼ qʼ s t tsʼ tɬ tɬʰ tɬʼ tʰ tʼ t̚ t̠ʃ t̠ʃʰ t̠ʃʼ t̪ t̪ɬ̪ t̪ɬ̪ʼ t̪ʰ t̪ʼ w w̰ x xʷ æ ŋ ŋ̰ ə ɪ ɬ ɬ̪ ʁ ʊ ʔ ˀj ˀl ˀm ˀn ˀw ˀŋ χ χʷ
squa1248,a aː e ei eː h i j k kʰ kʷ kʷʰ kʷʼ kʼ l lˠ l̩ m m̩ n n̩ o oː p pʰ pʼ q qʰ qʷ qʷʰ qʷʼ qʼ s t ts tsʼ tɬ tɬʼ tʰ tʼ t̚ t̠ʃ t̠ʃʼ u w xʷ ɐ ɒ ɔ ə ɛ ɛa ɛi ɪ ɬ ɵ ɵu ʃ ʉ ʔ χ χʷ
stra1244,a aː b b̚ d dz d̚ d̠ʒ e ei eɛ̯ eː h i j k kʷ kʷʼ kʼ l m n o p pʼ q qʷ qʷʼ qʼ s t ts tsʼ tɬʼ tʼ t̠ʃ t̠ʃʼ u w xʷ ɔ̆ ə ə̥ ɛ̆ ɜ ɡ ɡʷ ɪ ɬ ʃ ʊ ʊː ʔ χ χʷ
nuuc1236,a aː eː h i iː j j̰ k kʰ kʷ kʷʰ kʷʼ kʼ m m̰ n n̪ n̪̰ n̰ o oː p pʰ pʼ q qʰ qʷ qʷʰ qʷʼ qʼ s t ts tsʰ tsʼ tɬ tɬʰ tɬʼ tʰ tʼ t̠ʃ t̠ʃʰ t̠ʃʼ t̪ t̪ɬ̪ t̪ɬ̪ʼ t̪ʼ uː w w̰ x xʷ ħ ɔ ɔː ɛ ɛː ɪ ɬ ɬ̪ ʃ ʊ ʔ ʔˤ ʡ ˀj ˀm ˀn ˀw χ χʷ
kwak1269,a ai aː ă b cʰ cʼ ç d dl dz dɮ ei eːi h i iː j j̰ kʷʰ kʷʼ l l̩ l̰ m m̩ m̰ n n̩ n̰ ou oːu pʰ pʼ qʰ qʷʰ qʷʼ qʼ s tsʰ tsʼ tɬʰ tɬʼ tʰ tʼ u uː w w̰ xʷ æ ħ ɔ ə ɛ ɟ ɡʷ ɢ ɢʷ ɪ ɬ ʊ ʔ ˀj ˀl ˀm ˀn ˀw χ χʷ
east2542,a aː ã ãː b d d̠ʒ iː ĩː j k kʲ kʷ k͈ʲː k͈ʷː k͈ː l l̪ m m̥ m̩ n n̥ n̩ oː õː p p͈ː s s̪ s͈ː t t̠ʃ t̠͈ʃː t͈ː uː w z æː ɒː ə̆ ə̥̆ ɛ ɛː ɛ̃ː ɡ ɦ ɪ ɪ̃ ʃ ʃʲ ʃ͈ʲː ʃ͈ː ʊ ʊ̃ ʊ̆ ʊ̥̆ ʌ ʒ ʔ ʰk ʰp ʰs ʰs̪ ʰt ʰt̠ʃ ʰʃ
unam1242,a aː ãː b d d̠ʒ h hː i iː ĩː j k kʰ kː k̟ l lː m mː n nː p pʰ pː s sː t tʰ tː t̠ʃ t̠ʃʰ t̠ʃː u uː ũː w wː x xː z zː æː æ̃ː ŋ ɔ ɔː ɔ̃ː ə ə̃ː ɛ ɡ ʃ ʃː ʍ ʒ ʒː
wich1260,R̪̰ R̰ e eː h i iː j k kʰ kʲ kʷ kʷʰ kʼ n nː n̪ n̪ː o oː s sʼ sˀ sː s̪ s̪ʼ s̪ː t ts tsʼ tsː tʰ tː tːs t̪ t̪s̪ t̪s̪ʼ t̪s̪ː t̪ʰ u uː w w̰ z æː œ ɑ ɑː ɒ ɒː ɔ ɔː ɛ ɛː ɦ ɨ ɾ ɾˀ ɾ̥ ʈʂʰ ʍ ʔ
lako1247,a ã b e̞ h i ĩ j k kʰ kʼ k̚ l l̪ m m̥ n n̪ o p pʰ pʼ p̚ s sʼ s̪ s̪ʼ t tʰ tʼ t̚ t̠ʃ t̠ʃʰ t̠ʃʼ t̪ t̪ʰ t̪ʼ u ũ w w̃ x xʼ z z̪ ə̆ ɛ ɡ ɣ ʃ ʃʼ ʒ ʔ
sene1264,a aː ã b ç d dz d̠ʒ d̪z̪ e eː h i iː j k kʰ m n n̪ o̞ o̞ː s s̪ s̻ s̻͉ t tʰ t̪ u uː w æ æː ɔ̃ ɔ̃ː ɛ̃ ɛ̃ː ɜ ɡ ɪ ʃ ʊ ʔ ʝ
onei1249,a aː ḁ d d̠ʒ e̞ e̞ː e̞̥ f h i iː i̥ j j̥ k k͈ k͈̚ l l̥ n n̥ s s͈ t t̠ʃ t͈ t͈̚ v z ə̃ ə̃ː ə̥̃ ɡ ɤ̞ ɤ̞ː ɤ̞̥ ɦ ɯ̃ ɯ̃ː ɯ̥̃ ɰ ɰ̥ ɸ ʃ͈ ʔ β
yuch1247,a aː ã ãː b bˀ d dz dzˀ dˀ d̠ʒ d̠ʒˀ d̪ d̪z̪ e eː ẽ ẽː e̞ e̞ː ẽ̞ ẽ̞ː f fʼ h i iː ĩ j j̰ k kʰ kʼ k͉ l l̪ l̪̰ l̰ m n n̪ n̪̰ n̰ o oː õ õː o̞ o̞ː õ̞ õ̞ː p pʰ pʼ p͉ s sʼ s̪ s̪ʼ t ts tsʰ tsʼ tʰ tʼ t̠ʃ t̠ʃʰ t̠ʃʼ t̠ʃ͉ t̪ t̪s̪ t̪s̪ʰ t̪s̪ʼ t̪ʰ t̪ʼ t͉ t͉s u uː w w̰ æ æː æ̃ æ̃ː ŋ ɑ ɑi ɑ̃ ɔ̃ ɔ̃ː ə ɛ ɛ̃ ɛ̃ː ɡ ɡˀ ɤ ɤː ɤ̃ ɤ̃ː ɤ̞ ɤ̞ː ɤ̞̃ ɤ̞̃ː ɪ̃ ɪ̃ː ɬ ɬʼ ɬ̪ ɬ̪ʼ ɯ ɯː ɯ̞̃ ɯ̞̃ː ɲ ɶ̝ ɶ̝ː ɸ ɸʼ ʂ ʃ ʃʼ ʈʂ ʈʂʼ ʊ ʊː ʊ̃ ʊ̃ː ʌ ʌ̃ ʌ̃ː ʔ ʰk ʰp ʰt ʰts ʰt̠ʃ ˀj ˀl ˀn ˀw
alab1237,a aː ã ãː b d̠ʒ e eː ẽː h i j k k̚ l l̪ m n nː n̥ː n̪ o oː õ õː p p̚ s tɬ t̚ t̠ʃ t̪ t̪̚ w ŋ ɡ ɡ̚ ɪ ɪ̃ ɪ̥ ɬ ɬ̪ ɲ ɸ ʊ ʔ
tuni1252,a ã b d e ẽ f h i ĩ j k kʰ l l̥ m n n̥ o õ p pʰ r r̥ s s̻ t tʰ t̠ʃ t̠ʃʰ u ũ u̥ w x ɔ ɔ̃ ɛ ɛ̃ ɡ ʃ ʔ
nezp1238,a aː h iː j j̥ j̰ k kʰ kʲ kʼ l l̰ l̻ l̻ʲ l̻̥ l̻̰ m m̥ m̰ n nʲ n̥ n̪ n̪̰ n̰ o̞ o̞ː p pʰ pʼ p̚ qʰ qʼ q̚ qχ s s̻ s̻ʲ t tɬ tʰ tʲ tʼ t̚ t̪ t̪ʰ t̪ʲ t̪ʼ t̪̚ uː w w̰ x æ æː ŋ ɐ ɐː ɔ ɔː ə̯iː ə̯ɪ ɛ ɛː ɪ ɬ ɬʲ ɯ ɯː ɯ̞ ʀ̥ ʊ ʍ ʔ ʝ ˀj̥ ˀl̻̥ ˀm̥ ˀw̥ χ
nort2952,a aː cʰ cʼ c̚ e̞ ĕ̞ h i iː ĭ j k kʰ kʼ k̚ k̟ k̟ʰ k̟̚ l m m̥ m͉ n n̥ n͉ o̞ ŏ̞ p pʰ pʼ p̚ q qʰ q̚ s sː s͉ t tʰ tʼ t̚ u uː ŭ w x̟ ŋ ɓ ɔː ɔ̆ ɗ ɛː ɛ̆ ɨ ɨː ɨ̆ ɪ ɪ̆ ɪ̆̈ ɪ̈ ɪ̯ ʊ ʊ̆ ʊ̯ ʌ̆ ʔ χ
copa1236,a b c̟ d dz d̠ʒ f h h̃ i j j̃ k l m n o̞ p r s t ts t̚ t̠ʃ u w w̃ z ŋ ɛ ɟ̟ ɡ ɤ̞̃ ɤ̟̞̃ ɲ̟ ɾ ʃ ʔ βʲ
papa1238,aː a̰ː b d dz d̠ʒ eːə̯ h i iə̯ iː i̥ ḭ ḭː j j̥ j̰ k kʰ kː l l̰ m m̥ m̰ n n̥ n̰ p pʰ pː q qʰ qː s t ts tɬ tʰ tː t̠ʃ u uː u̥ ṵ ṵː w w̰ x z æ ŋ ɐ ɐ̥ ɐ̰ ɑː ɔ ɔː ə ɡ ɢ ɬ ɴ ɶ̝ ʃ ʍ ʒ ʔ
taba1266,a ãː ḁ a̰ b d e̞ ẽ̞ː e̞̥ e̞̰ f h i ĩː i̥ ḭ j k kʰ kʼ l m n o̞ õ̞ː o̞̥ o̞̰ p pʰ pʼ pˀ p̚ p̚ˀ r s t ts tsʼ tʰ tʼ t̚ t̠ʃ t̠ʃʼ u ũː u̥ ṵ v vʷˠ vˠ w x x̟ ŋ ə ə̃ː ə̥ ə̰ ɡ ɾ ʃ ʔ ʝ χ
tzel1254,a aː a̰ a̰ː b d d̪ e̞ e̞ː e̞̰ e̞̰ː f h hː j jː k kʰ kʰː kʼ kʼː l lː l̪ m mː n nː n̪ o̞ o̞ː o̞̰ o̞̰ː p pʰ pʰː pʼ pʼː r r̥ s sː s̪ t ts tsʼ tsʼː tsː tʰ tʰː tʼ tʼː t̠ʃ t̠ʃʼ t̠ʃʼː t̠ʃː t̪ t̪s̪ t̪s̪ʼ t̪ʼ w wː y ð ɡ ɣ ɪ ɪː ɪ̰ ɪ̰ː ɾ ɾː ʃ ʃː ʊ ʊː ʊ̰ ʊ̰ː ʔ ʔʰ ʔː β βː
pure1242,a ḁ b b͉ d d̠ʒ͉ d͉ d͉z d͉zː e ei f h i ii̯ i̥ j k kʰ kʷ kʷʰ k͉ l l̪ m m̥ n n̥ n̪ o o̞ p pʰ p͉ r s st sts stsː st̠ʃ sː s̪ t ts tsʰ tʰ t̠ʃ t̠ʃʰ t̠ʃː t̠ʃ͉ t͉ t͉s u u̥ w x æ ð ŋ ɛ ɛ̥ ɡ ɡ͉ ɣ ɨ˞ ɨ˞ː ɨ̥˞ ɭ ɲ ɸ ɹ ʂ ʂː ʃ ʍ ʔ ʰk ʰp ʰt ʰts ʰtsː ʰt̠ʃ β
karo1304,a aː ã a̟ a̟ː eː f fː fˑ h i iː ĩ j k kː kˑ k̚ m mː mˑ n nː nˑ n̪ oː p pː pˑ p̚ s sː sˑ s̪ s̻ s̻ˑ s̻θ t tː tˑ t̚ t̠ʃ t̠ʃˑ t̠ːʃ t̪ x xʀ̥ xʷ xʷː xː xːʀ̥ xˑ ə ɛ ɛː ɥ ɪ ɾ ʃ ʃː ʃˑ ʊ ʊː ʊ̈ː ʔ ˥ ˥˦ ˦˩ˀ ˧ ˩ ˩ˀ β̞ θ θː
sout2982,a aː b d f h j k kʼ l l̩ l̪ m m̩ n n̪ p pʼ q qʼ s s̪ t ts tsʼ tʼ t̠ʃ t̠ʃʼ t̪ t̪ʼ t̪θ w x ɔ ɔː ɖ ə ɛ ɛː ɨ ɪ ɪː ɴ ɾ ɾ̪ ʃ ʈ ʈʼ ʊ ʊː ʔ χ
kumi1248,a aː b eː e̞ j k kʰ kʷ k̚ l l̪ l̻ m mp m̩ n n̠ n̪ n̪t̪ o oː p pʰ p̚ q qʰ r s s̪ t tʰ t̠ʃ t̠ʃʰ t̪ t̪ʰ t̻̚ w x xʷ æ ɑ ɒ ɔ ɔː ə ɛ ɪ ɪː ɬ ɬ̻ ɮ̪ ɲ̟ ɹ ʊ ʊː ʌ ʔ β
zuni1245,a aː aˑ ḁ cʰ h i iː iˑ i̥ j jː j̥ kcʰ kʰ kʰː kʷʰ kʷʰː kʷʼ kʷʼː kʼ kʼː k̚ l lː l̥ l̪ m mː m̥ n nː n̥ n̪ p pʼ pʼː pː p̚ s sː s̪ t tsʰ tsʰː tsʼ tsʼː tʼ tʼː tː t̚ t̠ʃʰ t̠ʃʰː t̠ʃʼ t̠ʃʼː t̪ t̪s̪ʰ t̪s̪ʼ u uː uˑ u̥ w wː x xh ɔ ɔː ɔˑ ɔ̥ ɛ ɛː ɛˑ ɛ̥ ɬ ɬː ɬ̪ ʃ ʃː ʍ ʔ ʔː
sout2961,b d e ẽ e̞ ẽ̞ h i ĩ j k kʷ kʷʼ kʼ l lʲ m n o õ o̞ õ̞ p pʰ pʼ r s sɬ t ts tʰ tʼ t̠ʃ u ũ w x xʷ ŋ ɑ ɑ̃ ɔ ɔ̃ ə ə̃ ɛ ɛ̃ ɡ ɪ ɪ̃ ɬ ʔ ˥ ˧ ˩
tewa1260,a̟ a̟ː ã̟ ã̟ː b d d̠ʒ eː e̞ f h hʷ i iː ĩ j k kʷ kʷʼ kʼ m n nʲ oː o̞ p pʼ s t ts tsʼ tʲ tʼ t̠ʃ t̠ʃʼ u uː ũ ũː v w æː ŋ ɔ ɛ ɛ̃ ɛ̃ː ɡ ɪ ɸ ɾ ʃ ʔ ˥ ˥˦ ˧ ˩ β θ χ χʷ
luis1253,a aː e̞ e̞ː e̠̞ h j k kʰ kʷ l l̪ m n n̪ o̞ o̞ː p pʰ q qʰ qʷ qʷʰ r r̪ s t tʰ t̠ʃ t̪ v w x xʷ z͇ ð ŋ ɨ ɪ ɪː ɪ̠ ɪ̠ː ɾ ʁ ʂ ʃ ʊ ʊː ʔ β
hopi1249,a aː ă a̟ː ă̟ f h i iː ĭ j j̥ k kʲ kʷ l l̥ m m̥ n n̥ ou oːu o̞u p q s t ts tsʲ ŭ v w y̆ æ ø øː ø̆ ŋ ŋʷ ŋ̥ ɔ̆ ə̆ ɛ ɛ̆ ɤ ɤː ɪ ɪə ɪ̆ ɯ ɯː ɯ̆ ɲ ɸ ʂ͇ ʍ ʐ͇ ʔ ʰk ʰkʷ ʰp ʰq ʰt ʰts β
toho1245,a aː ḁ b d d̠ʒ d̪ h i iː i̥ j k k͉ m m̥ n n̠ n̥ n̪ p p͉ s s̪ t t̠ʃ t̠ʃ͉ t̪ t͉ u uː u̥ w ɔ ɔː ɔ̥ ɖ ɡ ɨ ɨː ɨ̥ ɲ̟ ɲ̟̥ ɺ ɺ̠ ɺ̥ ʂ ʈ͉ ʍ ʔ
