mokp1239,a aː b bʷ d̠ʒ e eː hʷ i iː j k kp l m mb n nd n̠d̠ʒ o oː p t u uː w ŋmɡb ŋɡ ɔ ɔː ɛ ɛː ɡb ɲ ɸ ʒ ˦ ˨ β
siam1242,a ã b bʲ bʷ c d dʲ dʷ e f fʲ fʷ h i ĩ j k kp kʲ l m mʲ mʷ n nʲ nʷ o p r s t tʲ tʷ u v w y ŋm ɔ ɔ̃ ə ɛ ɛ̃ ɟ ɡ ɡb ɡʲ ɯ ɲ ʃ ˥˩ ˦ ˦˥ ˧ ˨
tigo1236,a b bɾ bʱ bʲ bʷ d dɾ dʷ d̠ʒ d̠ʒɾ d̠ʒʷ e eː f fɾ fʲ fʷ h i j k kp kpɾ kpʲ kpʷ kɾ kʲ kʷ kʷɾ l m mb mbɾ mbʲ mbʷ mp mpɾ mpʷ mɾ mʲ mʷ n nd ndɾ ndʷ ns nsɾ nt ntɾ nz nzɾ nɡɾ nɾ nʷ n̠d̠ʒ n̠t̠ʃ n̠t̠ʃɾ n̠ʃ o p pɾ pʰ pʲ pʷ s sɾ sʷ t tɾ tʷ t̠ʃ t̠ʃɾ t̠ʃʷ u uː v vɾ vʲ vʷ w z zɾ ŋ ŋk ŋkɾ ŋkʷ ŋmkp ŋmkpɾ ŋmɡb ŋɡ ŋɡʷ ŋɾ ŋʷ ɑ ɔ ɔː ɛ ɛː ɡ ɡb ɡbɾ ɡɾ ɡʷ ɱf ɱfɾ ɱv ɱvɾ ɱvʲ ɲ ɾ ʃ ʒ ˥˩ ˦ ˧ ˨ ˩˥
orma1241,a aː ḁ b b̚ ç d d̚ d̠ʒ d̥̚ e eː e̥ f h i iː i̥ j k kʼ k̚ l m n nʲ o oː o̥ p pʼ p̚ r r̥ s t tʼ t̚ t̠ʃ t̠ʃʼ t̥̚ u uː u̥ w ŋ ɗ ɗ̚ ɡ ɡ̚ ɾ
piny1238,a aː b bʲ bʷ d dz dʲ dʷ d̠ʒ f i iə iɛ iː j k kʲ kʷ kᶣ l lʲ lʷ m mʲ n nʲ nʷ p pʰ pʲ pʷ s sʷ t ts tsʷ tʲ tʷ t̠ʃ t̠ʃʷ u uə uː w y yə z zʷ ŋ ŋʷ ɔ ɔː ə əː ɛ ɡ ɡʲ ɡʷ ɡᶣ ɣ ɥ ɨ ɨə ɨː ɲ ɲʷ ɾ ʃ ʃʷ ʒ ʒʷ ʔ ˥˩ ˦ ˧ ˨ ˩˥ β
pana1294,a aː ã ãː b d dz e eː ẽ ẽː f h hʲ hʷ i iː ĩ ĩː j k kp l m mb n nd ndz o oː õ õː p s sʷ t ts u uː ũ ũː v w z ŋ ŋmɡb ŋɡ ŋʷ ɓ ɔ ɔː ɔ̃ ɔ̃ː ɗ ɛ ɛː ɛ̃ ɛ̃ː ɡ ɡb ɲ ɾ ʔ ˥˩ ˦ ˨ ˩˥ ⱱ
reel1238,a aː aˑ a̤ a̤ː a̤ˑ b c ç d d̪ e eː eˑ e̤ e̤ː e̤ˑ i iː iˑ i̤ i̤ː i̤ˑ j k lʲ m n n̪ o oː oˑ o̤ p r s t t̪ u uː uˑ ṳ ṳː ṳˑ w ŋ ɔ ɔː ɔˑ ɔ̤ ɔ̤ː ɔ̤ˑ ɛ ɛː ɛˑ ɛ̤ ɛ̤ː ɛ̤ˑ ɟ ɡ ɦ ɲ ɸ ʔ ˦ ˨ ˩˥
wuzl1236,a b d dz d̠ʒ e f hʷ i j k kʷ l m mb n nd nz o p r s t ts t̠ʃ u v w z ŋ ŋɡ ŋɡʷ ɓ ɗ ə ɛ ɡ ɡʷ ɣ ɣʷ ɬ ɮ ʃ ʒ ˦ ˧ ˨ χ
lese1243,a b bv d dʷ d̠ʒ e f h i j k m n o p pf s sʷ t t̠ʃ u w œ ɓ ɔ ɛ ɠɓ ɡ ɡb ɪ ɭ ɭʷ ɾ ɾʲ ɾʷ ʈ ʊ ʔ ˦ ˧ ˨
gwen1239,a b c d e f h i j k kʲ l m n o p pf r t u w ŋ ɟ ɡ ɣ ɲ ʃ β θ
sumb1240,a aː b d d̠ʒ e eː f h i iː j k l m n o oː p s t t̠ʃ u uː v w z ɡ ʃ ˦ ˨ β
zinz1238,a aː b c d e eː f h i iː j k l m n o oː p s t u uː v w z ɟ ɡ ɲ ʃ
meru1245,a aː b d e eː f i iː j k l m n o oː p r s t u uː w ŋ ɲ ʃ β
kahe1238,b c d f h i iː j k l m n p r s t u uː v w ŋ ɑ ɑː ɔ ɔː ɛ ɛː ɟ ɡ ɣ ɲ ʃ
hang1260,a aː c d e eː f h i iː j k m n o oː p pf r s t ts u uː v w z ɟ ɡ ɲ ʃ ʒ ˦ ˨ β
moch1256,a b c d e f h i j k l m n o p pf s t ts u w ɟ ɡ ɲ ʃ
suba1252,a aː c d e eː f h i iː j k l m n o oː p r s t u uː v w z ŋ ɔ ɔː ɛ ɛː ɟ ɡ ɣ ɲ ʃ ˦ ˨ β
kway1241,a aː b d e eː f i iː j k l m n o oː p s t t̠ʃ u uː w ɔ ɔː ɛ ɛː ɟ ɡ ɲ ˦ ˨ β
wawa1246,a aː b d d̠ʒ e eː f h i iː j k kp kʷ l m mb n nd n̠d̠ʒ o oː p r s t t̠ʃ u uː w ŋ ŋm ŋmɡb ŋɡ ŋɡʷ ɔ ɔː ə əː ɛ ɛː ɡ ɡb ɡʷ ɱv ɲ ɾ ˦ ˧ ˨
tuni1251,a ã b b̚ c d d̚ e h i ĩ j k l m mb n nd o r s t u ũ w w̃ ŋ ŋɡ ɓ ɔ ɔ̃ ɗ ə ɛ ɛ̃ ɟ ɟ̚ ɠ ɡ ɡ̚ ɲ ɲɟ ʄ ʔ ˀm ˀn ˀɓ ˀɗ ˀɲ ˦ ˧ ˨ χ
bafa1249,a aː ã d̠ʒ e eː ẽ f i iː ĩ j kʰ kʷ l m mb n nd n̠d̠ʒ o oː õ p pʰ s t tʰ t̠ʃ u uː ũ v w z ŋ ŋɡ ŋɡʷ ŋʷ ɐ ɐː ɐ̃ ɔ ɔː ɔ̃ ə əː ə̃ ɛ ɛː ɛ̃ ɡ ɣ ɣʷ ɪ ɯ ɯː ɯ̃ ɱ ɲ ˦ ˧ ˨
burj1242,a aː b c d d̠ʒ e eː f h i iː j kʼ l m n o oː p pʼ r s t tʼ t̠ʃ t̠ʃʼ u uː w z ɡ ɲ ʃ ʔ ᶑ
anii1245,a b d d̠ʒ e f h i j k kp l m n o p r s t t̠ʃ u w ŋ ŋm ɔ ə ɛ ɡ ɡb ɨ ɪ ɲ ʃ ʊ ˦ ˨
fipa1238,a aː b d e eː f i iː j k l m n o oː p s t t̠ʃ u uː v w z ŋ ɡ ɪ ɪː ɲ ʃ ʊ ʊː ʒ ˦
nawu1242,a b bʷ d d̠ʒ e f fʷ h i j k kp kʷ l m mʷ n o p pʷ r s sʷ t t̠ʃ t̠ʃʷ u u̞ w ŋ ŋm ɔ ə ɛ ɡ ɡb ɨ ɪ ɪ̠ ɲ ʌ ˦ ˨
anfi1235,a aː b bː d dz dː e eː h i iː j jː k kʼ kʼː kː l lː m mː n nː o oː p pʼ pʼː pː r sʼ sʼː t ts tsʼ tsː tʼ tʼː tː u uː w wː ɡ ɡː ʃ ʔ
ntom1248,a b e f h i j k l m mb mp n nd ns nt n̠d̠ʒ o p s t ts u w ŋk ŋɡ ɔ ɛ ɡ ɲ
tumt1243,a aː d̪ d̪ː e eː f i iː j jː l lː m mb mː n nɗ nː n̪d̪ pf r rː s sː u uː w wː z ŋ ŋɡ ŋː ɓ ɓː ɔ ɔː ɖ ɖː ɗ ɗː ɟ ɡ ɡː ɤ ɤː ɪ ɪː ɯ ɯː ɲ ɲɟ ɲː ɳɖ ʃ ʊ ʊː ʊ̜ ʊ̜ː ʌ ʌː ʔ ˦ ˨
iyiv1238,a ai b bʷ d dz dzʷ dʲ d̠ʒ f fʷ h hʲ hʷ i j k kp kʷ lʲ lʷ m mb mbʷ mʷ n nd ndz ndzʷ nz n̠d̠ʒ o p pʷ s sʷ t ts tsʷ tʲ tʷ t̠ʃ t̠ʃʷ u v w ŋ ŋk ŋmɡb ŋɡ ŋɡʲ ŋɡʷ ɔ ə ɛ ɡ ɡb ɡʲ ɡʷ ɲ ʃ ʃʷ ˥˩ ˦ ˨ ˩˥
bata1293,a b d d̠ʒ e h i k l m n o p r s t t̠ʃ u w x y ŋ ɔ ə ɛ ɡ ɪ ɯ ɾ ʊ ʔ
sout2918,a b d e h i j k l m n o p r s t u w ŋ ə ɟ ɡ ɲ ʔ
kima1244,a b d d̠ʒ e i j k l m n p r s t u w ŋ ɓ ɗ ɡ ɤ ɾ ʃ ʔ
bela1260,a b c d e h i iə j k l m n o p q s t u w ŋ ə ɛ ɟ ɡ ɲ ʁ ʔ
east2563,a c cʰ e f h i j k kʰ l m n o p pʰ r s t tʰ u w x ŋ ɓ ɔ ɕ ɗ ə ɛ ɨ ɲ ʔ
mokl1243,a au̯ ay aː b d e eː h i ia iː k kʰ l m n o oː p pʰ t tʰ t̠ʃ t̠ʃʰ u uy uə uː w y ŋ ɔ ɔː ə əy əː ɛ ɛo ɛː ɡ ɯ ɯə ɯː ɲ ʔ
nias1242,a b d dr d̠ʒ e f h i j k m n o s t t̠ʃ u v w x ɡ ɤ ʋ ʔ
buol1237,a b d d̠ʒ e h i k l m n o p r s t̪ u w y ŋ ɡ ɽ ʎ ʔ β
maka1311,a b c d e h i j k l m n o p r s t u w ŋ ɟ ɡ ɲ ʔ
mori1268,a b d e h i k l m mb mp n nd ns nt o p r s t u ŋ ŋk ŋɡ ɡ ʔ β
kamb1299,a ai au aː d̠ʒ e h i iː j k l m mb n nd n̠d̠ʒ o p r t u uː w ŋ ŋɡ ɓ ɗ ɲj
leti1246,a aː d e eː i iː k l m n o oː p r s t u uː ɔ ɛ β
ambo1250,a b c d e f i j k l m n o p r s t u w ŋ ɟ ɡ ɲ
band1353,a b c d e f i j k l m n o p r s t u w ŋ ɟ ɡ ɲ
mala1481,a b c d e f i j k l m n o p r s t u w ŋ ə ɟ ɡ ɲ ʔ
kupa1239,a b c d e f i j k l m n o p r s t u w ŋ ə ɟ ɡ ɲ ʔ
lara1260,a b c d e f i j k l m n o p r s t u w ŋ ə ɟ ɡ ɲ ʔ
nort2828,a b c d e f i j k l m n o p r s t u w x ŋ ə ɟ ɡ ɲ ʃ ʔ
nucl1460,a b c cʰ d̪ f h i j k kʰ l m n p pʰ r s t̪ t̪ʰ u w ŋ ɔ ɖ ə ɛ ɟ ɡ ɤ ɨ ɲ ʈ ʈʰ ʔ
cebu1242,a b d d̠ʒ d̪ h i j k l m n p r s t t̠ʃ t̪ u w ŋ ɡ ɪ ʊ ʌ ʔ
bali1278,a b d d̠ʒ e h i j k l m n o p r s t t̠ʃ u w ŋ ə ɡ ɲ ʔ
bugi1244,a b d d̠ʒ e h i j k l m n o p r s t t̠ʃ u w ŋ ə ɡ ɲ ʔ
cent2087,a b d dz e f i j k l m n o p r s t ts u v w z ŋ ɡ ɲ ʃ ʎ ʔ
hili1240,a b d d̠ʒ e f h i j k l m n o p r s t t̠ʃ u v w ŋ ɡ ʔ
pamp1243,a b d d̠ʒ e h i k l m n o p r s t t̠ʃ u w ŋ ɛ ɡ ɾ ʎ ʔ
mina1268,a ai̯ au b d d̠ʒ e f h i iə j k l m n o p r s t t̠ʃ u ui̯ uə w x z ŋ ɡ ɲ ʃ ʔ
pang1290,a b d d̠ʒ e i j k l m n o p r s t t̠ʃ u w ŋ ɡ ʔ
teng1272,e e̤ h i i̤ j k l m mp n nt n̠t̠ʃ o o̤ p r t t̠ʃ u ṳ w ŋ ŋk ɑ ɑ̤ ɒ ɒ̤ ɔ ɔ̤ ə ə̤ ɛ ɛ̤ ɪ ɪ̤ ɲ ɳʈ ʈ ʊ ʊ̤ ʔ
abuj1237,a aː aˑ b cç d̪ e eː eˑ h i iː iˑ j k l m n o oː oˑ p r r̠ʲ s t̪ u uː uˑ w ŋ ɖ ə ɟʝ ɡ ɨ ɲ ɳ ʈ
anga1288,a b bv cç ç d dz e f h i j j̤ k kʰ l l̤ m m̤ n n̤ o p pf pʰ r r̤ s t ts tʰ u v w w̤ z ŋ ə ɟʝ ɡ ɱ ɲ ɲ̤ ʝ ˥ ˧ ˧˥ ˨˩ ˩
apat1240,a b bʲ cç d e h i j k l lʲ m mʲ n nʲ o p pʲ s t u ũː æ ŋ ə ɛ ɟʝ ɡ ɡʲ ɨ ɯ ɲ ɾ ʊ̃ ʌ ˥˩ ˧ ˩˥ β
assa1263,a ã b bʰ b̤ d dz dʰ d̤ d̪ d̪̤ d̺ d̺̤ e ẽ ẽ̞ h i ĩ j k kʰ k̚ l m n n̪ n̺ o õ õ̞ p pʰ p̚ r s s̻ t tʰ t̚ t̪ t̪ʰ t̪̚ t̺ t̺ʰ t̺̚ u ũ ũː u̞ w x z zʲ z̻ æ̞̃ ŋ ɑ ɑ̃ ɒ ɔ ə ɛ ɛ̃ ɡ ɡʰ ɡʱ ɡ̤ ɦ ɪ̃ ɹ ʊ ʊ̃ ʌ̃ β χ
awad1243,b b̤ cç cçʰ d̪ d̪̤ e h i j k kʰ l l̤ m m̤ n o p pʰ r r̤ s t̪ t̪ʰ u w æ ŋ ɑ ɔ ɖ ɖ̤ ɛ ɟʝ ɟ̤ʝ ɡ ɡʱ ɦ ɲ ɳ ɽ ɽ̤ ʈ ʈʰ
bada1257,a aː b c d̪ e eː i j k l m n o oː p r s t̪ u uː v w x ŋ ɖ ə ɛ ɟ ɡ ɨ ɭ ɲ ɳ ʂ ʈ ʌ ʝ
balt1258,a aː aˑ b cç cçʰ ç d d̠ʒ d̪ e eː eˑ f h i iː iˑ j k kʰ l l̥ m n o oː oˑ p pʰ q s t ts tsʰ tʰ t̠ʃ t̠ʃʰ t̪ t̪ʰ u uː uˑ w x z ð ŋ ɔ ɖ ɖʐ ɛ ɟʝ ɡ ɣ ɮ ɲ ɽ ʁ ʃ ʈ ʈʂ ʈʂʰ ʈʰ ʌ ʒ ʝ χ
lamb1269,a b cç ç dz d̪ e eː h i iː ĩː j k l m n n̪ o oː õ̞ p s s̪ ts t̪ u uː ũ ũː v w æ̞̃ ŋ ɑ ɑː ɖ ə əː ɟʝ ɡ ɨː ɨ̃ː ɪ̃ ɭ ɲ ɳ ɽ ɾ ʂ ʈ ʊ̃ ʌ
bhil1251,a aː aˑ b b̤ cç ç dz d̪ d̪̤ e eː eˑ ẽ̞ h i iː iˑ j k kʰ l l̤ m m̤ n̪ n̪̤ o oː oˑ õ p pʰ s ts t̪ t̪ʰ u uː uˑ ũː w ɖ ɖ̤ ə əː əˑ ɛ ɛː ɟʝ ɟ̤ʝ ɡ ɡʱ ɦ ɨ ɨː ɨˑ ɭ ɾ ʈ ʈʰ ʊ̃
bund1253,ã b b̤ cç cçʰ d̪ d̪̤ e eː h i iː j k kʰ l l̤ m m̤ n n̤ o oː p pʰ r r̤ s t̪ t̪ʰ u uː ũː v æ ŋ ɑ ɑː ɑ̃ ɔ ɖ ɖ̤ ɛ̃ ɟʝ ɟ̤ʝ ɡ ɡʱ ɦ ɲ ɳ ɽ ɽ̤ ʈ ʈʰ ʊ̃
chau1259,b b̤ cç cçʰ ç d̪ d̪̤ e i j k kʰ m n̪ o p pʰ r s ts t̪ t̪ʰ u w x z ŋ ɑ ɔ ɖ ɖ̤ ə ɛ ɟʝ ɟ̤ʝ ɡ ɡʱ ɭ ɭ̤ ɲ ʈ ʈʰ
chok1243,b cç cçʰ ç dz d̪ e f h i j k kʰ l l̤ m m̤ n̪ n̪̤ o p pʰ s ts tsʰ t̪ t̪ʰ u v w z ŋ ə ɟʝ ɡ ɦ ɾ ɾ̤ ʝ
darm1243,a ã b b̤ c cç cçʰ ç d̪ d̪̤ e h i j k kʰ l m n̪ o õ p pʰ r s t tʰ t̪ t̪ʰ u w x ŋ ɑ ɔ ɖ ɖ̤ ə ɛ ɟ ɟʝ ɟ̤ʝ ɡ ɡʱ ɲ ɳ ɽ ɽ̤ ɾ ʈ ʈʰ χ
gata1239,a ã b c cç d e ẽ h i ia ĩ j k l m n n̪ o oi õ õ̞ p r s t u ui ũ ũː u̯a u̯e u̯i w æ æ̞̃ ŋ œ ɔ ɖ ə ɛ ɟ ɟʝ ɡ ɪ ɲ ɳ ɽ ʈ ʊ ʔ ⁿb ⁿd ⁿɖ ⁿɟ ⁿɡ
gade1236,a b b̤ cç cçʰ d̪ d̪̤ e ẽ̞ h i ĩ j k kʰ l m n̪ o õ õ̞ p pʰ r s t̪ t̪ʰ u ũː w æ æ̞̃ ɖ ɖ̤ ə ə̃ ɛ ɟʝ ɟ̤ʝ ɡ ɡʱ ɪ ɪ̃ ɭ ɳ ɽ ʈ ʈʰ ʊ ʊ̃
galo1242,a aː b cç d̪ e h i iː j k l m n̪ o p s t̪ u uː ŋ ɔ ɔː ə ɟʝ ɡ ɨ ɲ ɾ
guja1252,a ã ã̈ː ä ã̤̈ː ä̤ b b̤ b̤ʱ cç cçʰ ç d̠ʒ d̤ʒ̤ʱ d̪ d̪̤ d̪̤ʱ e ẽ̞ e̤ f h i ĩː i̤ i̤ː ĩ̤ː j k kʰ l m n n̪ o õ õː o̤ p pʰ s t̠ʃ t̠ʃʰ t̪ t̪ʰ u ũ ũː ṳ ṳː ṳ̃ː v w æ ŋ ɑ̃ ɑ̤ ɔ ɔ̃ː ɔ̤ ɔ̤̃ː ɖ ɖ̤ ɖ̤ʱ ə ə̃ː ə̤ ə̤̃ː ɛ ɛ̃ː ɛ̤ ɛ̤̃ː ɟʝ ɟ̤ʝ ɡ ɡ̤ʱ ɦ ɪ ɭ ɲ ɳ ɺ ɽ ɾ ʂ ʃ ʈ ʈʰ ʊ ʋ
bodo1267,a ai ao ã a̰ b b̰ cç d̪ e ei ẽ ḛ h i ia ie io ĩ ĩã ĩõ k l m n o oi õ õ̞ o̰ p r s t t̪ t̪̰ u ũ ũː ṵ z æ̞̃ ŋ ɔ ɖ ɟ ɟʝ ɡ ɪ ɪ̃ ɭ ɯ̰ ɲ ɳ ɽ ʈ ʊ ʊ̃ ʌ ʔ
halb1244,a b b̤ cç ç d d̤ e f h i j k kʰ l m n o p pʰ r s t ts tʰ u v w z æ ø ŋ ɘ ɛ ɟʝ ɡ ɡʱ ɨ ɪ ʊ ʌ ʔ
hooo1248,a ai au aː ã b c cç d d̪ e eː ẽ e̞ h i iː ĩ j k l m n n̪ o oe oː õ õ̞ p r s t t̪ u uː ũ u̞ w æ̞̃ ŋ ɖ ɟ ɟʝ ɡ ɪ ɪ̃ ɲ ɳ ɽ ɾ ʈ ʊ ʌ ʔ
irul1243,a ä b cç d d̪ e ë e̞ ë̞ i ï j k l m n n̪ o ö ö̞ p r s t t̪ u üː u̞ v w x æ ð ŋ ɖ ə ɛ ɟʝ ɡ ɣ ɨ ɪ ɭ ɲ ɳ ɽ ɾ ʂ ʈ ʊ ʊ̈ ʌ β
jaun1243,a aː b b̤ cç cçʰ ç d̪ d̪̤ e ẽ̞ h i iː j k kʰ l m n o õː õ̞ p pʰ r s t̪ t̪ʰ u uː w æ̞̃ ŋ ɑ̃ ɔ ɖ ɖ̤ ə̃ː ɛ ɟʝ ɟ̤ʝ ɡ ɡʱ ɦ ɲ ɳ ɽ ʈ ʈʰ ʊ̃
kang1280,aː b c c̤ d̪ e iː j k kʰ l m n o p pʰ r s t̪ t̪ʰ uː w ŋ ɐ ɔː ɖ ɘ ɛː ɜ ɟ ɡ ɪ ɭ ɲ ɳ ɽ ɽ̃ ɽ̩ ʈ ʈʰ ʊ
nucl1305,a aː b bʰ b̤ c cç cçʰ cʰ ç d̪ d̪ʰ d̪̤ e eː f h i iː j k kʰ l l̪ m n n̪ o oː p pʰ r̪ s s̪ t̪ t̪ʰ u uː v w z̪ æ ŋ ɖ ɖʰ ɖ̤ ɟ ɟʝ ɟʰ ɟ̤ʝ ɡ ɡʰ ɡʱ ɭ ɳ ɾ ʂ ʃ ʈ ʈʰ
saur1248,a aː b b̤ cç cçʰ d̪ d̪̤ e eː h i iː j k kʰ l m m̤ n o oː p pʰ r s t̪ t̪ʰ u uː w z ɖ ɖ̤ ɟʝ ɟ̤ʝ ɡ ɡʱ ɭ ɳ ʈ ʈʰ
karb1241,a b b̤ cç cçʰ d dz d̤ e e̞ i j k kʰ l m n o p pʰ r t ts tsʰ tʰ u w x ŋ ɔ ə ɛ ɟʝ ɡ ɡʱ ɦ ɪ ʊ ʔ ˥ ˧ ˩
jenn1240,a b cç dz d̪ e i j k l m n n̪ o p r s ts t̪ u w z ŋ ɖ ə ɟʝ ɡ ɨ ɭ ɲ ɾ ʂ ʈ
khez1235,b bv cç cçʰ ç dz d̪ e e̞ f h i j k kʰ l l̤ m m̤ n n̤ n̪ n̪̤ o p pf pfʰ pʰ s ts tsʰ t̪ t̪ʰ u v w w̤ z ŋ ɑ ə ɟʝ ɡ ɦ ɨ ɲ ɲ̤ ɾ ɾ̤ ʝ ˥ ˧ ˩
koda1255,a aː b cç ç d̪ e eː ë ëː e̞ h i iː j k l m n n̪ o oː p r s t̪ u uː u̞ w ð ŋ ɑ ɑː ɔ ɖ ə ɛ ɛː ɟʝ ɡ ɨ ɪ ɭ ɯ ɲ ɳ ɽ ʂ ʈ ʊ ʌ
nort2699,a aː b cç dz d̪ e eː i iː j k l m n̪ o oː p r s ts t̪ u uː v z ŋ ɖ ə əː ɟʝ ɡ ɨː ɭ ʈ
kond1295,a aː b d̪ e eː h i iː ĩː j k l m n o oː õː õ̞ p r r̥ s t̪ u uː ũ ũː w z æ̞̃ ŋ ɑ̃ː ɖ ə̃ː ɡ ɪ̃ ɳ ɽ ɾ ʈ ʊ̃ ʔ
mudh1235,a aː b cç d i iː j k l m n õː p r s t u uː ũ ũː w æ̞̃ ŋ ɖ ə̃ː ɟʝ ɡ ɳ ʈ ʊ̃
korr1238,a aː b cç ç d̪ e eː i iː j k l m n̪ o oː p r s t̪ u uː w ŋ ɖ ɛ ɛː ɟʝ ɡ ɨ ɲ ɳ ʈ
kork1243,a ã b bʰ b̤ c c̤ d dʰ d̤ e ẽ h i ĩ j k kʰ l m mʰ n o õ õ̞ p pʰ r s t tʰ u ũ ũː w æ̞̃ ŋ ɖ ɖʰ ɟ ɟʰ ɟ̤ ɡ ɡʰ ɡʱ ɨ ɪ̃ ɲ ɽ ɾ ʈ ʈʰ ʊ̃ ʔ
kuii1252,a aː ãː b d̪ e eː h i iː ĩː k l m n p s t̪ u uː ũ ũː v æ̞̃ ŋ ɑ̃ ɔ ɔː ɖ ə̃ː ɟʝ ɡ ɪ̃ ɲ ɳ ɽ ʈ ʊ̃ ʔ
kuma1273,a b b̤ cç cçʰ ç d̪ d̪̤ e i j k kʰ l m n̪ o p pʰ t̪ t̪ʰ u w ŋ ɔ ɖ ɖ̤ ə ɛ ɟʝ ɟ̤ʝ ɡ ɡʱ ɪ ɭ ɳ ɽ ɾ ʈ ʈʰ ʊ ʌ
lepc1244,b cç ç dz d̪ e e̞ f h i j k l m n o ö p s ts t̪ u üː v z ŋ ɑ ɔ ɖ ɟʝ ɡ ɲ ɾ ʈ ʌ ʝ
loth1237,a bv cç cçʰ ç d̪ e f i j k kʰ l l̤ m m̤ n̪ n̪̤ o p pf pʰ r r̤ s ts tsʰ t̪ t̪ʰ u v w z ŋ ŋ̤ ə ɡ ɦ ɪ ɲ ɲ̤ ʊ ʝ ˥˩ ˧ ˩˥
lush1249,a b cç cçʰ d̪ e f h i j k kʰ l m n̪ o p pʰ s t̪ t̪ɬ̪ t̪ɬ̪ʰ t̪ʰ u v w z ŋ ɔ ɡ ɾ ɾ̪̥ ɾ̪̥ʰ ʔ ʱl ʱm ʱn̪ ʱŋ ʱɾ ˥ ˥˩ ˧˩ ˩˥
mait1250,a ai au ã b bʰ b̤ cç cçʰ ç d̠ʒ d̠ʒʰ d̪ d̪ʰ d̪̤ e eu ẽ h i iu ĩ j k kʰ m n o oi ou õ p pʰ r s t̠ʃ t̠ʃʰ t̪ t̪ʰ u ui ũ w æ æ̃ ŋ ɔ ɔ̃ ɖ ɖʰ ɖ̤ ə əi əu ə̃ ɟʝ ɟ̤ʝ ɡ ɡʰ ɡʱ ɲ ɳ ɽ ɽ̤ ɾ ʂ ʈ ʈʰ
mala1464,a ai au aː b bʰ c cʰ ç d dʰ d̪ e ei eː f h i iː j k kʰ l l̠˞ m n n̪ o oi oː p pʰ r r̪ s t tʰ t̪ u uː w æ ŋ ɖ ɖʰ ə ɟ ɟʰ ɡ ɡʰ ɨ ɭ ɲ ɳ ɾ ʂ ʃ ʈ ʈʰ ʊ ʋ ʐ
saur1249,a aː b c d̪ e eː h i iː j k l m n n̪ o oː p q r s t̪ u uː w ŋ ɖ ɟ ɡ ɢ ɣ ɲ ɽ ʈ θ θ̪
maon1238,a b bv ç dz d̪ e f i j k l m n o p pf r ts t̪ u v w ə ɡ ʝ ˥ ˧ ˨ ˩
mara1378,a b b̤ cç cçʰ ç dz d̤z d̪ d̪̤ e f h i iː j k kʰ l l̤ m m̤ n̪ n̪̤ o p pʰ s ts tsʰ t̪ t̪ʰ u uː w w̤ æ ɔ ɖ ɖ̤ ə əː ɟʝ ɟ̤ʝ ɡ ɡʱ ɨ ɨː ɳ ɳ̤ ɾ ɾ̤ ʂ ʈ ʈʰ
miju1243,ã b bʷ cç cçʰ ç dz d̪ d̪ʲ e eː h i iː j k kʰ k̰ l lʲ m n o oː õ̞ p pʰ pʷ p̰ r s ts tsʰ t̪ t̪ʰ t̪ʲ u uː w z ŋ ɑ ɑː ɟʝ ɡ ɨ ɪ̃ ɯ ɲ ʌ ˥˩ ˧ ˩˥ ˩˧˩
miny1240,a b b̤ b̰ d d̤ d̪ e h i j k kʰ l m n n̪ p pʰ r s t ts tʰ t̪ t̪̰ u w z z̤ ŋ ɔ ɛ ɟʝ ɡ ɡʱ ɡ̰ ɪ ɯ ɲ ɽ ɾ ʊ ˥˩ ˧ ˩˥
moyo1238,a b b̤ cç ç d̤ e f h i j kʰ l m m̩ n̩ o p pʰ r s ts tʰ u v w æ ŋ̩ ɔ ɘ ə ɛ ɡʱ ɨ ʊ ʌ ʔ ˥˩ ˧ ˩˥
naik1250,a b b̤ dz d̤z d̪ d̪̤ e i j k kʰ l m n̪ o p pʰ r r̠ r̠ʲ s t ts tsʰ t̪ t̪ʰ u u̞ v w x ŋ ɖ ɖ̤ ɛ ɡ ɡʱ ɪ ɭ ɳ ʂ ʈ ʈʰ ʊ ʌ
nepa1254,a ai au aː ã b bʰ bː b̞ b̞̤ b̤ b̤ː c cç cçʰ cʰ ç dz dzː d̤z̤ d̤z̤ː d̪ d̪ʰ d̪ː d̪̞ d̪̞z̪̞ d̪̞̤ d̪̞̤z̪̞̤ d̪̤ d̪̤ː e ei eu eː ẽ h i iu iː ĩ j k kʰ kʰː kː l lː l̤ m mː n nː n̪ o oi ou oː õ p pʰ pʰː pː r rː s sː ts tsʰ tsʰː tsː t̪ t̪ʰ t̪ʰː t̪ː u ui uː ũ w x ŋ ŋː ɔ ɖ ɖʰ ɖː ɖ̞ ɖ̞̤ ɖ̤ ɖ̤ː ə əi əĩ əu əũ ə̃ ɛ ɜ ɞ ɟ ɟʝ ɟʰ ɟ̤ʝ ɡ ɡʰ ɡʱ ɡː ɡ̞ ɡ̞̤ ɡ̤ ɡ̤ː ɣ ɦ ɲ ɸ ɽ ɽ̃ ɽ̤ ɾ ʂ ʈ ʈʰ ʈʰː ʈː ʌ ʌi ʌu ʌ̃ β ∅
cent1990,cç d e eː f h i iː k l m n̪ o oː p r s t u uː æ ŋ ɑ ɑː ɔ ɔː ə əː ɛ ɛː ɨː ɯ ɲ ɾ ʈ
pott1240,a aː ã ãː b c cç dz d̪ e eː ẽ ẽː i iː ĩ ĩː j k l l̪ m n̪ o oː õ õː õ̞ p r r̪ s s̪ ts t̪ u uː ũ ũː v w z æ̞̃ ŋ ɖ ɟ ɟʝ ɡ ɲ ɳ ʈ
oriy1255,a ã b bʰ b̤ c cç cçʰ cʰ d̪ d̪ʰ d̪̤ e ẽ h i ĩ j k kʰ l l̪ m n̪ o õ̞ p pʰ r s s̪ t̪ t̪ʰ u ũ ũː w æ̃ ŋ ɑ̃ ɔ ɔ̃ ɖ ɖʰ ɖ̤ ɛ̞ ɟ ɟʝ ɟʰ ɟ̤ʝ ɡ ɡʰ ɡʱ ɪ̃ ɭ ɳ ɾ ʈ ʈʰ ʊ̃
pait1244,a e f h i j k l m n o p pʰ s t tʰ t̪ u v w x z ɔ ɡ ʔ ˥ ˦˥ ˨ ˩ ˩˨
duru1236,a aː b cç d̪ e eː h i iː j k l m n o oː p s t̪ u uː w ŋ ɖ ɟʝ ɡ ɲ ɽ ɾ ʈ
patt1248,b cç cçʰ ç dz d̪ e i j k kʰ l l̤ m m̤ n n̤ o p pʰ r r̤ s ts tsʰ t̪ t̪ʰ u w z ŋ ɑ ɖ ə ɟʝ ɡ ɭ ɲ ɳ ɽ ɽ̤ ʂ ʈ ʈʰ
peng1244,a aː b cç d̪ e eː h i iː j k l m n o oː p s t̪ u uː v z ŋ ɖ ɟʝ ɡ ɳ ɽ ɾ ʈ
sans1269,a aː b b̤ cç cçʰ ç d̪ d̪̤ eː h i iː j k kʰ l m n oː p pʰ r s t̪ t̪ʰ u uː w ŋ ɖ ɖ̤ ɟʝ ɟ̤ʝ ɡ ɡʱ ɦ ɭ ɲ ɳ ɽ ɽ̤ ʂ ʈ ʈʰ
sant1410,a ae ao ã b bʰ b̤ b̰ c cç cçʰ d dʰ d̪ d̪̤ e ea ei eo h i io iu iə ĩ j k kʰ k̰ l m n n̪ o oa oe oi õ õ̞ p pʰ p̰ r s t tʰ t̪ t̪ʰ t̪̰ u ui uə ũ ũː w ŋ ɑ ɔ ɔe ɔ̃ ɖ ɖʰ ɖ̤ ə əi əu ə̃ ɛ ɛo ɛ̃ ɟ ɟʝ ɟʰ ɟ̤ʝ ɡ ɡʱ ɪ̃ ɲ ɽ ʈ ʈʰ ʊ̃
sumi1235,a b c cç cçʰ ç d d̠ʒ d̪ e e̞ f h i j k kʰ l lʲ l̤ m m̤ m̩ n nʲ n̤ n̪ o p pʰ q qx qʰ r s t ts tsʰ tʰ t̠ʃ t̠ʃʰ t̪ t̪ʰ u u̞ v vʲ w x z ŋ ɔ ɕ ə ɛ ɟ ɡ ɣ ɨ ɯ ɲ ɲ̤ ɹ ʃ ʌ ʑ ʒ ʔ ʝ ˥ ˦ ˧ ˨ ˩ ∅
shin1264,a aː b cç cçʰ ç d e eː h i iː j k kʰ l m n o oː p pʰ r s t ts tsʰ tʰ u uː w x z ŋ ɖ ə ɛ ɛː ɟʝ ɡ ɣ ɳ ʈ ʈʂ ʈʂʰ ʈʰ ʐ ʝ
sora1254,a b c d e i j k l m n n̪ o p r r̠ʲ s t t̪ u y z ø ŋ ɖ ə ɟ ɟʝ ɡ ɨ ɪ ɲ ɳ ɽ ɾ ʊ ʔ
tang1336,a b cç ç d̪ e e̞ f h i j k kʰ l m n o p pʰ r s t̪ t̪ʰ u v w x z ŋ ɔ ə ɟʝ ɡ ɨ ɪ ɯ ɾ ʊ ʌ ʝ
tase1235,b cç ç d̪ e h k kʰ l m n̪ o p pʰ s ts t̪ t̪ʰ u x ŋ ɑː ɔ ə ɟʝ ɡ ɸ ɾ ʔ
thad1238,a b cç d e i j k kʰ l l̤ m n o p pʰ s t tʰ u v x z ŋ ɔ ɛ ɟʝ ɡ ɦ ʌ ʔ ˥˩ ˧ ˩˥
toda1252,a b cç ç d dz d̪ e f i j k l l̥ m n o p r s s̪ t ts t̪ u v w x y yː z z̪ ø øː ɔ ɖ ɟʝ ɡ ɪ ɭ ɭ̥ ɯ ɯː ɳ ɽ ɾ ʂ ʈ ʊ ʌ ʐ ʝ θ
kokb1239,a b cç cçʰ ç d̪ h j k kʰ l m n̪ o p pʰ r s ts tsʰ t̪ t̪ʰ u w ŋ ɔ ɛ ɟʝ ɡ ɪ ɯ ɲ ʊ ʌ
ural1274,ä b c d̪ e ë e̞ ë̞ i iː ï j k l m n n̪ o p r s t̪ u uː üː u̞ w x ð ɑ ɑ̈ ɑ̈ː ɖ ɛ ɟ ɡ ɣ ɪ ɭ ɳ ɽ ʂ ʈ ʊ ʌ β
urdu1245,a ã̈ː äː b b̤ b̤ʱ cç cçʰ ç d̠ʒ d̤ʒ̤ʱ d̪ d̪̤ d̻ d̻̤ʱ eː ẽː ẽ̞ f h i iː ĩ ĩː j k kʰ l̻ m n n̻ oː õ õː p pʰ q r s t̠ʃ t̠ʃʰ t̪ t̪ʰ t̻ t̻ʰ u uː ũː w x z æ æ̞̃ ŋ ɑ̃ ɑ̃ː ɔ ɔː ɔ̃ː ɖ ɖ̤ ɖ̤ʱ ə ə̃ ɛ ɛː ɛ̃ː ɟʝ ɟ̤ʝ ɡ ɡʱ ɡ̤ʱ ɣ ɦ ɪ ɪ̃ ɽ ɽ̤ʱ ʂ ʃ ʈ ʈʰ ʊ ʊ̃ ʋ ʝ
vaag1238,a aː b cç ç d̪ e eː i iː j k l m n o oː p r s t̪ u uː v z æ̞̃ ŋ ɖ ɟʝ ɡ ɨ ɪ̃ ɭ ɲ ɳ ʈ ʊ̃
ravu1237,a aː b c cç d̪ e eː i iː j k l m n n̪ o oː p r s t̪ u uː w ŋ ɔ ɖ ə ɛ ɛː ɟ ɡ ɪ ɭ ɲ ɳ ʈ ʊ
yeru1240,a aː b cç d̪ e eː i iː ĩː j k l m n o oː õ̞ p s t̪ u uː w æ̞̃ ɑ̃ː ɖ ə̃ː ɟʝ ɡ ɨ ɪ̃ ɭ ɳ ɾ ʂ ʈ ʊ̃
acha1250,a aː b d e eː h i iː j k kʷ l m n o oː p s t ts t̠ʃ u uː w ɾ ʃ ʒ ʔ
araw1276,a b d e h i j k kʰ l m n o s t tʰ w ɨ ɸ ɽ ɾ
ajyi1238,N a aː ç h i iː j k m n o oː p s t ts tsʰ tʰ t̠ʃ t̠ʃʰ ɰ ɲ ɾ ɾʲ ʋ
ashe1272,N a aː e eː h i iː j k kʲ m n o oː p s t ts tsʰ t̠ʃ w ɨ ɨː ɲ ɾ ɾʲ ʃ
pich1237,N a aː e eː h i iː j k kʲ m mʲ n o oː p pʲ s t tʰ t̠ʃ t̠ʃʰ w wʲ ɰ ɲ ɾ ɾʲ ʃ
ucay1237,N a aː e eː h i iː j k kʲ m mʲ n o oː p pʲ s t ts tsʰ tʰ t̠ʃ t̠ʃʰ ɰ ɲ ɾ ɾʲ ʃ β βʲ
bare1276,a b d e h i j k kʰ m n p pʰ s t tʰ t̠ʃ u w ɻ ʱm ʱn ʱw
cabi1241,a e h i j k m n o p t t̠ʃ t̪ u w ɾ ʔ
caqu1242,N a aː e eː h i iː j k m n o oː p s t ts tʲ t̠ʃ ŋ ɣ ɲ ɾ ɾʲ ʃ β
curr1243,a b d dz e h i j k kʰ m n p pʰ t ts tʰ u w ɸ ɺ ɾ ʂ ʃ ʔ ʱm ʱn ʱɾ β
enaw1238,a aː ã d e eː ẽ h i iː ĩ j k l m n o oː õ s t w ɲ ɾ ʃ
inap1243,a aː ã e eː ẽ h i iː ĩ j l m n o oː õ p s t t̠ʃ u uː ũ w ɯ ɯː ɯ̃ ɲ ɾ ʔ
guan1270,a ã e ẽ h i ĩ j k l m n o õ p s t u ũ w ɾ ʃ ʔ
mach1268,a e h i j k m n o p s t ts t̠ʃ w ɨ ɾ ʃ
mach1267,N a aː e eː i iː j k kʲ m n o oː p s t ts tʲ t̠ʃ ɡ ɨi ɲ ɾ ɾʲ ʃ β
mehi1240,a ã e ẽ h i ĩ j k l m n p t ts t̠ʃ u ũ w ɨ ɨ̃ ɾ ʂ
nant1250,N a aː b e eː h i iː j k m n o oː p s t ts tʲ t̠ʃ ɡ ɨi ɲ ɾ ɾʲ ʃ
noma1263,N a aː b e eː h i iː j k m n o oː p s t ts t̠ʃ ŋ ɡ ɨi ɾ ʃ
pali1279,a ã b d e ẽ h i ĩ j k m n o õ p s t u ũ w ɡ ɣ ʃ
para1316,a aː e eː h i iː j k l m n o oː p t t̠ʃ u uː w ɨ ɨː ɲ ɾ ʃ
pare1272,a b e h i j k kʷ l m n o t ts tʲ w ɸ ɾ θ
piap1246,a b d e h i j k m n p s t ts u ɺ ɾ ʔ β
tari1256,a aː ã b d dʱ e eː ẽ h i iː ĩ j k kʰ l m mʱ n nʱ o õ p pʰ s t tʰ t̠ʃ u uː ũ w wʱ ɨ ɲ ɲʱ ɾ
tere1279,a aː h i iː j k l m n o oː p s t u uː w ɛ ɛː ɾ ʃ ʔ
guar1293,a aː b d d̠ʒ e eː h i iː j k m n p t ts t̠ʃ u uː w ɡ ɲ ɺ ʃ
waur1244,a ã e ẽ h i ĩ j k l n p s t ts tʲ u ũ w ɣ ɨ ɨ̃ ɲ ɾ ʒ β
xiri1243,a b c d e h i k m n p s t ts u w x ɟ ɨ ɲ ɸ ɾ ʀ ʔ
yavi1244,a b d dz e h i j k m n s t ts u w ɡ ɲ ɺ ɺ̥ ɾ
yawa1261,a h i j k l m n p r̥ t ts t̠ʃ u w ɨ ɲ ɾ ʂ ʃ ʎ
baur1253,a e h i j k m n o p s t t̠ʃ v w ɾ ʃ ʔ
deni1241,a dz e h i k kʰ m n p pʰ t ts tsʰ tʰ u w ɓ ɗ ɾ ʔ β
culi1244,a b d dz e h i k kʰ m n o p pʰ t ts tsʰ tʰ w ɾ ʔ
paum1247,a aː b d d̠ʒ h i iː k kʰ m n o oː p s t tʰ t̠ʃ ɓ ɗ ɡ ɸ ɽ ɾ ʃ ʔ β
suru1263,a b d dʲ d̠ʒ h i k m n nʲ o s t tʲ w z ɛ ɡ ɨ ɾ ɾʲ ʃ
cent2142,a aː ç h i iː j k kʰ kʼ l m n p pʰ pʼ q qʰ qʼ s t tʰ tʼ t̠ʃ t̠ʃʰ t̠ʃʼ u uː v w x ŋ ɲ ɾ ʎ χ
bora1263,a aː e eː h hʲ i iː j k kʰ kʲ kʲʰ kʷ m mʲ n o oː p pʰ pʲ pʲʰ t ts tsʰ tʰ tʲ tʲʰ t̠ʃ t̠ʃʰ ɨ ɨː ɯ ɯː ɲ ɾ ʔ ʔʲ β βʲ
mira1254,a aʲ aʲː aː b d dz d̠ʒ h i iː k m n o oː p t ts t̠ʃ ɛ ɛː ɡ ɡʷ ɨ ɨː ɯ ɯː ɾ ʔ β
chay1248,a h i j k m n p s t t̠ʃ u w ɨ ɾ ʃ ʔ β
akur1238,a aː e eː i iː j k m n o oː p t t̠ʃ u uː w ə əː ɨ ɨː ɾ ʔ
apal1257,a ã e ẽ i ĩ j k m n o õ p s t u ũ w z ɨ ɨ̃ ɾ ʃ ʔ
para1310,a e i j k l m n o p t t̠ʃ u w ŋ ɨ ɾ
cari1279,a b d d̠ʒ e h i k m n o s t t̠ʃ u w ə ɡ ɨ ɲ ɾ
ikpe1245,a e i j k l m n o p t t̠ʃ u w ŋ ɡ ɨ ɾ
kaxu1237,a e h i j k m n o p s t t̠ʃ u w ɨ ɾ ʔ
kuik1246,a ã dʲ e ẽ h i ĩ k l m n o õ p s t ts u ũ w ŋ ɣ ɨ ɨ̃ ɲ
macu1259,a aː e eː i iː j k m n o oː p s t u uː w ɨ ɨː ɾ ʔ
mapo1246,a e h i j k m n o p s t u w ə ɨ ɲ ɾ ʔ
maqu1238,a aː e eː h i iː j k m n o oː s t t̠ʃ u uː w ə əː ɨ ɨː ɲ ɾ ʔ
pemo1248,a aː e eː i iː j k m n o oː p s t u uː w ə ɤ ɯ ɾ ʔ
pemo1245,a e h i j k m n o p s t u w ə ɨ ɲ ɾ ʔ
trio1238,a aː e eː h i iː j k m n o oː p s t u uː w ə əː ɨ ɨː ɾ
waim1253,a aː b d d̠ʒ e eː h i j m n o oː p s t t̠ʃ u w ɛ ɨ ɨː ɲ ɾ ʃ ʔ
waiw1244,a e h i j k m n o s t t̠ʃ u w ɨ ɲ ɸ ɺ ɾ ʃ
yaba1248,a e h i j k m n o p s t u w ə ɨ ɲ ɾ
orow1243,a e i j k m n o p s t t̪ʙ w ø ɾ ʏ ʔ β
bari1297,a ã b d e ẽ h i ĩ k m n o õ r s t u ũ ɨ ɨ̃ ɲ
chib1270,a e h i j k kp m n o p s t ts tʲ u w ɣ ɨ ɾ ʃ β
chim1309,a aː ã ãː e eː ẽ ẽː h i iː ĩ ĩː j k l m mb n nd o oː õ õː p s t u uː ũ ũː w ŋ ŋɡ ɾ ʔ
cogu1240,a ã b bː d dː e ẽ h i ĩ j k kː l m n o p s t tː u ũ w x z ŋ ə ɡ ɡː ɨ ɨ̃ ʃ ʒ ʔ
mala1522,a b d d̠ʒ e h i j k l m n o p r s t t̠ʃ u ũ w z ɡ ɨ ɾ ʃ ʒ
cent2150,a b e h i j k kʷ m n o s t u w w̃ ɾ ʃ ʔ
woun1238,a ã b ç d e ẽ h i ĩ j k kʰ m n o õ p pʰ r s t tʰ u ũ w ɡ ɤ ɤ̃ ɯ ɯ̃ ɾ ʔ
embe1259,a ã b d e ẽ h i ĩ j k kʰ l m n o õ p pʰ r s t tʰ t̠ʃ u ũ w ɓ ɗ ɨ ɨ̃ ɾ β
embe1260,a ã b d d̠ʒ e ẽ h i ĩ kʰ kʼ m n o õ pʰ pʼ r sʰ sʼ tʰ tʼ t̠ʃʰ t̠ʃʼ u ũ w ɯ ɯ̃ ɾ
embe1262,a ã b d e ẽ i ĩ j k m n o õ p r s t t̠ʃ u ũ w x ɓ ɗ ɯ ɯ̃ ɾ
nort2972,a ã b d e ẽ h i ĩ j k kʰ m n o õ p r s t ts t̠ʃ u ũ w ɓ ɗ ɠ ɡ ɯ ɯ̃ ɾ
puel1244,a b e h i j kʰ kʼ l l̥ m o p pʼ q r s t ts tsʼ tʼ t̠ʃ t̠ʃʼ u w x ə ɡ ɨ ʂ ʃ ʈʂ ʈʂʼ ʎ ʔ ʱd
onaa1245,a aː e eː h i j k kʼ l m n o oː p pʼ q qʼ s t tʼ t̠ʃ u w x ɾ ʂ ʃ ʔ
coca1259,a e i j k m n p t ts t̠ʃ u w x ɨ ɾ
cuib1242,a b d e h i j k kʰ m n o p pʰ s t ts tʰ t̠ʃ u w æ ɨ ɲ ʌ
guay1257,a b d e h i j k l m n o p s t t̠ʃ u w x ɨ ɸ ɾ
maca1259,a b e h i j k kʰ m n o p pʰ s t ts tʰ u w ɭ ɯ ɾ
amar1274,a aː ã ãː e eː ẽ ẽː i iː ĩ ĩː j k m mb n nd o oː õ õː p s t w x ŋ ŋɡ ɨ ɨː ɾ ʔ
chol1284,a i j k l m n p s t tx t̠ʃ u w ŋ ɪ ɲ ʊ ʎ ʔ
abis1238,a ã e h i ĩ j k kʲ kʷ l m n o õ p s t ts t̠ʃ u ũ w ɨ ɾ ʃ ʔ
cand1248,a aː h i iː j k m mp n nt nts n̠t̠ʃ o oː p s t ts t̠ʃ w ŋk ɳʈʂ ɾ ʂ ʃ ʈʂ
leco1242,a b d e h i j k kʰ kʼ l m n o p pʰ pʼ s t ts tʰ tʼ t̠ʃ t̠ʃʼ u w z ŋ ɨ ɾ
moch1259,a aː e eː i iː j k l lʲ m n o oː p s t ts t̠ʃ u uː x ŋ ɲ ɵ ɵː ɸ ɾ ɾʲ ʂ ʃ ʈʂ
muni1258,a c ç d e h i j k l m n p s t ts t̠ʃ u w ɡ ɨ ɲ ɾ ʂ ʃ ʈʂ ʔ
puin1248,a ã e h i ĩ k m n o õ p s t u ɤ ɤ̃ ɯ ʔ
taus1253,a h i j k kʷ n o t t̠ʃ u w x ɨ ɲ ɾ ʔ
tini1245,a aː a̰ b c d e eː ḛ h i iː ḭ k kʰ kʷ m n o oː o̰ p pʰ s t ts tʰ t̠ʃ u uː ṵ w z ɟ ɡ ɨ ɨː ɨ̰ ɲ ɸ
urar1246,a b d e fʷ h hʲ i k kʷ l m n s t t̠ʃ u ɲ ɽ ʃ ʉ
vile1241,a b d e h i j k kʼ l m n o p pʼ q qʼ s t tʼ t̠ʃ t̠ʃʼ u w ɡ ɢ ɬ ɾ ʔ
